Fragebogen, der im Interview verwendet wurde;Geschlecht;Alter: Alter in Jahren;Land;Ethnie;Bildung;Bildung: Anderer Abschluss;Beschäftigungsstatus;Hand;ProbandenID: [01];LEARN-User;Gruppe;AppKunde;App Kunde Langzeit;AppLieferant;App Lieferant Langzeit;RollenKunde: Ausweichoption (negativ) oder Anzahl ausgewählter Optionen;;RollenKunde: Kunde;;RollenKunde: Debitor;;RollenKunde: Interessent;;RollenKunde: Anfragender;;RollenKunde: Kreditor;;RollenKunde: Lieferant;;RollenLieferant: Ausweichoption (negativ) oder Anzahl ausgewählter Optionen;;RollenLieferant: Kunde;;RollenLieferant: Debitor;;RollenLieferant: Interessent;;RollenLieferant: Anfragender;;RollenLieferant: Kreditor;;RollenLieferant: Lieferant;;Bereich Kunde;;Abstimmkonto Lieferant;;Abstimmkonto Kunde;;Sichern;;Nummer;;Neu hinzufügen;;Buchungskreisspezifische Daten;;E-Learning Einstellung: E-Learning ist vorteilhaft;;E-Learning Einstellung: E-Learning ist besser als traditionelles Lernen;;E-Learning Einstellung: E-Learning kann traditionelles Lernen verbessern;;E-Learning Einstellung: Traditionelles Lernen ist besser als E-Learning;;E-Learning Einstellung: E-Learning ist zu überfordernd;;E-Learning Einstellung: E-Learning hilft, Lernen flexibler zu gestalten;;E-Learning Einstellung: E-Learning hilft, Lernen individueller zu gestalten;;E-Learning Einstellung: Ich würde gerne an mehr E-Learning Kursen teilnehmen;;E-Learning Medien: Ausweichoption (negativ) oder Anzahl ausgewählter Optionen;;E-Learning Medien: PDF-Dokumente;;E-Learning Medien: Videos;;E-Learning Medien: Audio Dateien;;E-Learning Medien: Live-Sessions mit dem Dozenten;;E-Learning Medien: Text;;E-Learning Medien: Bilder;;E-Learning;;ES EUT;;ES EUT: Ja;;Einstellung EUT;;Einstellung EUT: Ja;;Einstellung EUT: Nein;;E-Learning EUT;;E-Learning EUT: Präsenztraining;;E-Learning EUT: E-Learning;;SAP Kenntnisse;;Motivprofil: Ich bin ständig auf der Suche nach neuen Erfahrungen.;Motivprofil: Ich brauche vertraute Menschen um mich herum.;Motivprofil: In meinem Umfeld wird mir mehr als anderen zugebilligt, Kritik zu äußern.;Motivprofil: Um Erfolg zu haben, scheue ich keinen Aufwand.;Motivprofil: Ich will, dass mein Partner/meine Partnerin mich bewundert.;Motivprofil: Am liebsten möchte ich ständig etwas unternehmen.;Motivprofil: Zugehörigkeit ist mir sehr wichtig.;Motivprofil: In meinem Beruf mache ich viel mehr als das, was von mir verlangt wird.;Motivprofil: Mir ist es äußerst wichtig, mich bei meinem Lebenspartner immer geborgen zu fühlen.;Motivprofil: Unbekannte Situationen finde ich sehr reizvoll.;Motivprofil: In einem Arbeitsteam übernehme ich gerne die Führung.;Motivprofil: Ich fühle mich unwohl, wenn ich längere Zeit keine vertrauten Menschen um mich habe.;Motivprofil: Ich begebe mich in meiner Freizeit gerne in aufregende Situationen, die auch gefährlich sein können.;Motivprofil: Ich habe hohe Ansprüche an mich selbst.;Motivprofil: Ich strebe Macht und Einfluss an.;Motivprofil: Ich wünsche mir einen guten Kontakt zu meiner Verwandschaft.;Motivprofil: Ich will, dass mein Partner/meine Partnerin mich gegenüber anderen in einem sehr guten Licht darstellt.;Motivprofil: Es beschäftigt mich, wie ich meine schon guten Leistungen noch besser machen kann.;Motivprofil: Ich bringe andere gezielt dazu, Dinge zu tun die sie von sich aus nicht getan hätten.;Motivprofil: Eine gute Leistung ohne Lob ist für mich weniger wert.;Motivprofil: Es wäre für mich schlimm, wenn ich im Urlaub sehr krank werde und kein Bekannter bei mir ist.;Motivprofil: Es macht mir Freude, ungewohnte Dinge zu erleben.;Motivprofil: Bei der Planung von Aktivitäten im Freundeskreis setze ich mich letztendlich durch.;Motivprofil: Ein beruflicher Erfolg ist besonders schön, wenn andere ihn auch bemerken.;Motivprofil: Es macht mir Spaß, an Problemen zu arbeiten, die ein bisschen schwierig für mich sind.;Motivprofil: Ich liebe Nervenkitzel.;Motivprofil: Ich brauche sehr viele positive Rückmeldungen von meinem Umfeld.;Motivprofil: Bei Entscheidungen setze ich meinen Willen manchmal auch gegen Widerstände durch.;Motivprofil: Mir ist es wichtig, gute Leistung zu bringen.;Motivprofil: Ich wäre gerne eine berühmte Person.;VARK 1: Ausweichoption (negativ) oder Anzahl ausgewählter Optionen;VARK 1: den Weg zusammen gehen.;VARK 1: den Weg erklären.;VARK 1: eine Wegerklärung aufschreiben.;VARK 1: eine Karte zeichnen oder eine Karte zeigen oder geben.;VARK 2: Ausweichoption (negativ) oder Anzahl ausgewählter Optionen;VARK 2: die Schaubilder zu sehen.;VARK 2: beim Zuhören.;VARK 2: die Worte zu lesen.;VARK 2: die Handlungen zu beobachten.;VARK 3: Ausweichoption (negativ) oder Anzahl ausgewählter Optionen;VARK 3: einige Höhepunkte beschreiben, die sie erleben werden.;VARK 3: eine Karte benutzen, um ihnen die Orte zu zeigen.;VARK 3: ihnen eine Kopie des ausgedruckten Reiseverlaufs geben.;VARK 3: sie anrufen, texten oder eine E-Mail schreiben.;VARK 4: Ausweichoption (negativ) oder Anzahl ausgewählter Optionen;VARK 4: etwas kochen, was du kennst und wofür du keine Anleitung brauchst.;VARK 4: Freunde um Empfehlungen bitten.;VARK 4: im Internet oder in einigen Kochbüchern stöbern, um von den Bildern Ideen zu bekommen.;VARK 4: ein Rezept benutzen.;VARK 5: Ausweichoption (negativ) oder Anzahl ausgewählter Optionen;VARK 5: über die Parks und Wildreservate sprechen oder jemanden Fachkundigen zum Gespräch bitten.;VARK 5: ihnen Karten und Bilder im Internet zeigen.;VARK 5: zusammen mit ihnen einen Park oder ein Wildreservat besuchen.;VARK 5: ihnen ein Buch oder Flyer über Parks und Wildreservate geben.;VARK 6: Ausweichoption (negativ) oder Anzahl ausgewählter Optionen;VARK 6: Es anzufassen und auszuprobieren.;VARK 6: Details und Funktionen zum Handy nachzulesen.;VARK 6: Es hat ein modernes Design und sieht gut aus.;VARK 6: Der Verkäufer erklärt mir seine Funktionen.;VARK 7: Ausweichoption (negativ) oder Anzahl ausgewählter Optionen;VARK 7: Zuschauen bei einer Veranschaulichung, einer Durchführung oder eines Beispiels.;VARK 7: Zuhören, wie eine Person es erklärt und nachfragen.;VARK 7: Schaubilder, Karten und Graphiken – visuelle Hinweise.;VARK 7: Schriftliche Anweisungen – z.B. eine Betriebsanleitung oder ein Buch.;VARK 8: Ausweichoption (negativ) oder Anzahl ausgewählter Optionen;VARK 8: Ihnen etwas zum Nachlesen gibt, das erklärt, was das Problem ist.;VARK 8: ein Plastikmodell benutzt und Ihnen zeigt, was das Problem ist.;VARK 8: Ihnen beschreibt, was das Problem ist.;VARK 8: Ihnen ein Schaubild zeigt, was das Problem ist.;VARK 9: Ausweichoption (negativ) oder Anzahl ausgewählter Optionen;VARK 9: die mitgelieferten geschriebenen Anweisungen lesen.;VARK 9: mit Personen sprechen, die sich mit dem Programm auskennen.;VARK 9: Ihnen ein Demovideo anschauen oder die Tastatur/Joystick benutzen, um es auszuprobieren.;VARK 9: den Schaubildern im mitgelieferten Handbuch folgen.;VARK 10: Ausweichoption (negativ) oder Anzahl ausgewählter Optionen;VARK 10: Dinge, auf die man klicken kann, die man angucken, bewegen oder ausprobieren kann.;VARK 10: ein interessantes Design und visuelle Merkmale.;VARK 10: interessante Beschreibungen, Listen und Erklärungen.;VARK 10: Audiokanäle, auf denen du Musik, Radio oder Interviews hören kannst.;VARK 11: Ausweichoption (negativ) oder Anzahl ausgewählter Optionen;VARK 11: Durchblättern und die Seiten überfliegen.;VARK 11: Einen Abschnitt lesen.;VARK 11: Bericht und Empfehlung eines Freundes.;VARK 11: Dass es Geschichten, Erfahrungen und Beispiele aus dem wahren Leben enthält;VARK 12: Ausweichoption (negativ) oder Anzahl ausgewählter Optionen;VARK 12: Fragen stellen und über die Bedienungsmöglichkeiten sprechen.;VARK 12: eine klare schriftliche Anleitung haben mit Listen und Punkten zur Bedienung.;VARK 12: Piktogramme und Schaubilder sehen, die zeigen, wie man es benutzt.;VARK 12: verschiedene Einstellungen und Funktionen ausprobieren.;VARK 13: Ausweichoption (negativ) oder Anzahl ausgewählter Optionen;VARK 13: Veranschaulichungen, Modelle und praktische Einheiten.;VARK 13: Gruppendiskussionen, Fragen-und-Antworten und Gespräche.;VARK 13: Handouts, Bücher und Texte.;VARK 13: Schaubilder, Tabellen oder Diagramme.;VARK 14: Ausweichoption (negativ) oder Anzahl ausgewählter Optionen;VARK 14: indem Beispielen genannt werden, was du gemacht hast.;VARK 14: als schriftliche Beschreibung deiner Ergebnisse.;VARK 14: von jemandem, der über deine Ergebnisse spricht.;VARK 14: mit Diagrammen, Schaubildern und Illustrationen deiner Ergebnisse.;VARK 15: Ausweichoption (negativ) oder Anzahl ausgewählter Optionen;VARK 15: a. etwas nehmen, was Sie schon mal hier gegessen haben.;VARK 15: b. dem Kellner zuhören oder andere Fragen, was sie empfehlen können.;VARK 15: c. ein Menü von der Speisekarte wählen.;VARK 15: d. schauen, was andere essen oder sich Bilder der einzelnen Speisen angucken;VARK 16: Ausweichoption (negativ) oder Anzahl ausgewählter Optionen;VARK 16: Schaubilder, Tabellen und Illustrationen zeigen, um verschiedene Punkte zu erklären.;VARK 16: sich ein paar Schlüsselwörter aufschreiben und die Rede mehrmals üben, indem du Sie sie sich vorsprechen.;VARK 16: die Rede aufschreiben und durch mehrmaliges Lesen auswendig lernen.;VARK 16: Beispiele, Fotos und Geschichten benutzen, um die Rede authentisch und praktisch zu gestalten.;Lernpräferenz VARK;Auswertung Visuell;Auswertung Aural;Auswertung Read;Auswertung Kinesthetic;Medium;Medium2;BegründungMedium: [01];VerbesserungPDF: [01];Verbesserung Video: [01];WünscheEUT: [01];Dauer Gesamt;Dauer Aufgabe 1 Sek;Dauer Aufgabe 2 Sek;Protokoll
base;männlich;27;;Germany;Master Abschluss;;Angestellte/r;Rechts;ID00;LEARN-003;B;Kunde anlegen;Kunde anlegen;Lieferant anlegen;Lieferant anlegen;1;1;ausgewählt;ausgewählt;nicht gewählt;nicht gewählt;nicht gewählt;nicht gewählt;nicht gewählt;nicht gewählt;nicht gewählt;nicht gewählt;nicht gewählt;nicht gewählt;1;1;nicht gewählt;nicht gewählt;nicht gewählt;nicht gewählt;nicht gewählt;nicht gewählt;nicht gewählt;nicht gewählt;nicht gewählt;nicht gewählt;ausgewählt;ausgewählt;Vertriebsbereich;Vertriebswegsbereich;Lieferantenabstimmkonto;Lieferantenabstimmkonto;Kundenabstimmkonto;Kundenabstimmkonto;Übernehmen;Übernehmen;Oben links neben dem Namen des Kunden/Lieferanten;Im Dropdownfeld;Neu;Anlegen;"Schaltfläche ""Buchungskreisspezifische Daten""";"Schaltfläche ""Buchungskreisspezifische Daten""";Ich stimme zu;Ich stimme zu;3;3;4;Ich stimme zu;2;3;2;2;Ich stimme zu;4;Ich stimme zu;4;3;3;6;6;ausgewählt;ausgewählt;ausgewählt;ausgewählt;ausgewählt;ausgewählt;ausgewählt;ausgewählt;ausgewählt;ausgewählt;ausgewählt;ausgewählt;Ja;Ja;Nein;;;;Ja;Ja;sytematisches Erlernen der Anwendung;Einfaches lernen des Systems;;;E-Learning;E-Learning;;;Parallele Anwendung;man kann es selber einteilen;Nein;Nein;Eher typisch für mich;Eher typisch für mich;Eher typisch für mich;Ziemlich typisch für mich;Ziemlich untypisch für mich;Eher typisch für mich;Eher untypisch für mich;Ziemlich typisch für mich;Eher typisch für mich;Eher typisch für mich;Ziemlich typisch für mich;Ziemlich typisch für mich;Eher typisch für mich;Sehr typisch für mich;Eher typisch für mich;Sehr typisch für mich;Eher typisch für mich;Sehr typisch für mich;Eher untypisch für mich;Ziemlich untypisch für mich;Eher untypisch für mich;Ziemlich typisch für mich;Eher typisch für mich;Eher untypisch für mich;Sehr typisch für mich;Eher typisch für mich;Eher untypisch für mich;Ziemlich typisch für mich;Sehr typisch für mich;Ziemlich untypisch für mich;1;nicht gewählt;ausgewählt;nicht gewählt;nicht gewählt;1;nicht gewählt;ausgewählt;nicht gewählt;nicht gewählt;1;nicht gewählt;ausgewählt;nicht gewählt;nicht gewählt;1;nicht gewählt;nicht gewählt;ausgewählt;nicht gewählt;2;nicht gewählt;ausgewählt;ausgewählt;nicht gewählt;1;nicht gewählt;ausgewählt;nicht gewählt;nicht gewählt;1;ausgewählt;nicht gewählt;nicht gewählt;nicht gewählt;1;nicht gewählt;nicht gewählt;ausgewählt;nicht gewählt;2;nicht gewählt;ausgewählt;ausgewählt;nicht gewählt;2;ausgewählt;nicht gewählt;nicht gewählt;ausgewählt;2;ausgewählt;ausgewählt;nicht gewählt;nicht gewählt;2;ausgewählt;nicht gewählt;nicht gewählt;ausgewählt;2;ausgewählt;nicht gewählt;nicht gewählt;ausgewählt;2;ausgewählt;nicht gewählt;ausgewählt;nicht gewählt;2;nicht gewählt;ausgewählt;ausgewählt;nicht gewählt;2;ausgewählt;nicht gewählt;nicht gewählt;ausgewählt;VAK;6;8;3;8;PDF;Beides;;Keine;Keine;Kombination verschiedener Lernmedien;;;;
base;weiblich;23;;Germany;Abitur;;Studierende/r;Rechts;ID02;LEARN-004;A;Kunde anlegen;Debitor anlegen;Lieferant anlegen;Kreditor anlegen;1;1;ausgewählt;nicht gewählt;nicht gewählt;ausgewählt;nicht gewählt;nicht gewählt;nicht gewählt;nicht gewählt;nicht gewählt;nicht gewählt;nicht gewählt;nicht gewählt;1;1;nicht gewählt;nicht gewählt;nicht gewählt;nicht gewählt;nicht gewählt;nicht gewählt;nicht gewählt;nicht gewählt;nicht gewählt;ausgewählt;ausgewählt;nicht gewählt;Vertriebsbereich;Buchungskreisbereich;Abstimmkonto;Lieferantenabstimmkonto;Kundenabstimmkonto;Kundenabstimmkonto;Anwenden;Anlegen;Oben rechts;Im Dropdownfeld;Anlegen;Anlegen;"Schaltfläche ""GP-Rolle""";"Schaltfläche ""Anlegen""";Ich stimme zu;3;Ich stimme nicht zu;4;Ich stimme zu;4;Ich stimme zu;Ich stimme zu;3;Ich stimme zu;4;Ich stimme zu;4;Ich stimme zu;3;3;3;4;nicht gewählt;nicht gewählt;ausgewählt;ausgewählt;nicht gewählt;ausgewählt;ausgewählt;ausgewählt;nicht gewählt;nicht gewählt;ausgewählt;ausgewählt;Nein;Ja;Nein;;;;Nein;Ja;;Um zu wissen was zu tun ist;-;;Präsenztraining;Präsenztraining;Präsenz ist meistens besser als digital;u.a. wegen der Möglichkeit für Rückfragen bei unverständlicher Formulierungen/Darstellung des Lehrmaterials;;Realitätsnäheres Lernen;Nein;Ja;Sehr typisch für mich;Ziemlich typisch für mich;Eher untypisch für mich;Eher typisch für mich;Eher typisch für mich;Ziemlich typisch für mich;Sehr typisch für mich;Eher untypisch für mich;Sehr typisch für mich;Ziemlich typisch für mich;Eher untypisch für mich;Eher typisch für mich;Ziemlich typisch für mich;Eher untypisch für mich;Ziemlich untypisch für mich;Sehr typisch für mich;Ziemlich typisch für mich;Eher typisch für mich;Eher typisch für mich;Eher typisch für mich;Eher untypisch für mich;Ziemlich typisch für mich;Eher untypisch für mich;Ziemlich typisch für mich;Eher untypisch für mich;Eher typisch für mich;Ziemlich typisch für mich;Eher typisch für mich;Ziemlich typisch für mich;Eher typisch für mich;2;nicht gewählt;ausgewählt;ausgewählt;nicht gewählt;2;ausgewählt;nicht gewählt;nicht gewählt;ausgewählt;2;ausgewählt;ausgewählt;nicht gewählt;nicht gewählt;3;nicht gewählt;ausgewählt;ausgewählt;ausgewählt;3;ausgewählt;ausgewählt;ausgewählt;nicht gewählt;3;ausgewählt;ausgewählt;ausgewählt;nicht gewählt;3;ausgewählt;ausgewählt;ausgewählt;nicht gewählt;2;nicht gewählt;ausgewählt;nicht gewählt;ausgewählt;3;nicht gewählt;ausgewählt;ausgewählt;ausgewählt;3;ausgewählt;ausgewählt;nicht gewählt;ausgewählt;2;ausgewählt;nicht gewählt;ausgewählt;nicht gewählt;3;ausgewählt;nicht gewählt;ausgewählt;ausgewählt;2;ausgewählt;ausgewählt;nicht gewählt;nicht gewählt;1;ausgewählt;nicht gewählt;nicht gewählt;nicht gewählt;2;nicht gewählt;ausgewählt;nicht gewählt;ausgewählt;2;ausgewählt;nicht gewählt;ausgewählt;nicht gewählt;VAK;13;10;4;11;PDF;Video;Das Video hat mir bildhafter gezeigt was nacheinander zu tun ist und ich konnte andauernd die Schritte im Video mit meinen Schritten vergleichen;Mehr Bilder, stichpunktartigere Darstellung ;An einer Stelle ist nicht nachzuvollziehen welchen Schritt die Person im Video unternimmt da der Curser nicht sichtbar ist. Die Ansicht des Bildschirms ändert sich ohne zu wissen was geklickt wurde;Videos dauerhaft zur Verfügung stehen, Training in Anwesenheit einer echten Person um Fragen und Unverständlichkeiten direkt zu klären;2707;1305.98;1401.22;Fehlermeldung, konnte nicht gespeichert werden
base;männlich;21;;Germany;Abitur;;Studierende/r;Rechts;ID03;LEARN-005;B;Kunde anlegen;Geschäftspartnerstammdaten verwalten;Lieferant anlegen;Kreditor anlegen;2;2;ausgewählt;nicht gewählt;nicht gewählt;nicht gewählt;nicht gewählt;ausgewählt;nicht gewählt;nicht gewählt;nicht gewählt;ausgewählt;ausgewählt;nicht gewählt;2;2;ausgewählt;nicht gewählt;nicht gewählt;ausgewählt;nicht gewählt;ausgewählt;ausgewählt;nicht gewählt;nicht gewählt;nicht gewählt;nicht gewählt;nicht gewählt;Vertriebsbereich;Buchungskreisbereich;Verbindlichkeiten aus Lieferungen und Leistungen;Verbindlichkeiten aus Lieferungen und Leistungen;Forderungen aus Lieferungen und Leistungen;Forderungen aus Lieferungen und Leistungen;Anwenden;Anwenden;Oben links neben dem Namen des Kunden/Lieferanten;Oben links neben dem Namen des Kunden/Lieferanten;Jeweilige Schaltfläche Buchungskreise, Rollen, Adressdetails;Hinzufügen;"Schaltfläche ""Buchungskreisspezifische Daten""";"Schaltfläche ""Buchungskreisspezifische Daten""";Ich stimme zu;Ich stimme zu;Ich stimme zu;4;Ich stimme zu;Ich stimme zu;3;2;Ich stimme nicht zu;Ich stimme nicht zu;Ich stimme zu;Ich stimme zu;Ich stimme zu;Ich stimme zu;Ich stimme zu;Ich stimme zu;6;6;ausgewählt;ausgewählt;ausgewählt;ausgewählt;ausgewählt;ausgewählt;ausgewählt;ausgewählt;ausgewählt;ausgewählt;ausgewählt;ausgewählt;Nein;Ja;Nein;;;;Ja;Ja;Je nach Anwendung kann es die Einarbeitug erleichtern und schneller zu effizienteren Prozessen führen.;hilft der Mitarbeiterakzeptanz und führt zu effizienterer Arbeitsweise;;;E-Learning;E-Learning;;;Mehr Flexibilität;;Nein;Nein;Sehr typisch für mich;Eher untypisch für mich;Eher untypisch für mich;Sehr typisch für mich;Ziemlich untypisch für mich;Sehr untypisch für mich;Eher typisch für mich;Sehr typisch für mich;Sehr typisch für mich;Eher typisch für mich;Sehr typisch für mich;Ziemlich untypisch für mich;Eher untypisch für mich;Ziemlich typisch für mich;Sehr typisch für mich;Sehr typisch für mich;Sehr typisch für mich;Ziemlich untypisch für mich;Sehr typisch für mich;Ziemlich untypisch für mich;Eher typisch für mich;Sehr typisch für mich;Eher typisch für mich;Eher typisch für mich;Sehr typisch für mich;Sehr untypisch für mich;Eher untypisch für mich;Eher typisch für mich;Eher typisch für mich;Eher typisch für mich;3;nicht gewählt;ausgewählt;ausgewählt;ausgewählt;2;nicht gewählt;nicht gewählt;ausgewählt;ausgewählt;2;nicht gewählt;ausgewählt;nicht gewählt;ausgewählt;2;nicht gewählt;ausgewählt;ausgewählt;nicht gewählt;2;ausgewählt;ausgewählt;nicht gewählt;nicht gewählt;3;ausgewählt;ausgewählt;ausgewählt;nicht gewählt;3;nicht gewählt;ausgewählt;ausgewählt;ausgewählt;2;nicht gewählt;nicht gewählt;ausgewählt;ausgewählt;1;nicht gewählt;nicht gewählt;ausgewählt;nicht gewählt;4;ausgewählt;ausgewählt;ausgewählt;ausgewählt;2;ausgewählt;nicht gewählt;nicht gewählt;ausgewählt;1;nicht gewählt;nicht gewählt;nicht gewählt;ausgewählt;3;ausgewählt;ausgewählt;nicht gewählt;ausgewählt;2;ausgewählt;nicht gewählt;ausgewählt;nicht gewählt;4;ausgewählt;ausgewählt;ausgewählt;ausgewählt;2;ausgewählt;nicht gewählt;nicht gewählt;ausgewählt;VARK;11;10;6;11;Video;PDF;Ein mit Bildern geschmückets PDF hat dazu geführt, dass ich schneller die Abläufe verstehen konnte, als mit einem Video, wo ich häufiger zurückspulen musste. Das hat Zeit gekostet im Vergleich zur PDF;"Es könnte hier in eine Plattform-Umgebung eingebunden werden, um dadurch abschnittsweise lernen zu können. Man könnte Inhalte also in Abschnitte einteilen, ohne das man vorher die folgenden Abschnitte sieht. Nach Beendigung eines Abschnittes sollte der Anwender auf ""weiter"" klicken können.";Es könnte eine Plattform eingebunden werden, sodass Videos abschnittsweise geschaut werden können und sich jeder Abschnitt solange wiederholt, bis der Nutzer den Abschnitt beendet hat.;Eine angemessene Kombination aus Video und Text/Bild. Dem Nutzer sollte die Freiheit gegeben werden selber zu entscheiden, wie er lernen möchte.;1454;689.28;764.29;Fehlermeldung, konnte nicht gespeichert werden
base;weiblich;25;;Germany;Bachelor Abschluss;;Studierende/r;Rechts;ID04;LEARN-006;A;Kunde anlegen;;Lieferant anlegen;;2;;ausgewählt;;nicht gewählt;;nicht gewählt;;nicht gewählt;;nicht gewählt;nicht gewählt;ausgewählt;ausgewählt;3;2;nicht gewählt;ausgewählt;nicht gewählt;nicht gewählt;ausgewählt;nicht gewählt;ausgewählt;;nicht gewählt;;ausgewählt;;Vertriebswegsbereich;;Forderungen aus Lieferungen und Leistungen;;Verbindlichkeiten aus Lieferungen und Leistungen;;Anlegen;;Oben rechts;;Jeweilige Schaltfläche Buchungskreise, Rollen, Adressdetails;;"Schaltfläche ""Buchungskreisspezifische Daten""";;Ich stimme zu;;3;;4;;3;;Ich stimme nicht zu;;4;;4;;4;;5;;ausgewählt;;ausgewählt;;ausgewählt;;nicht gewählt;;ausgewählt;;ausgewählt;;Ja;;Ja;;ERP;;Ja;;Oberfläche und Begriffe kennengelernt;;;;E-Learning;;;;kann man flexibel einbinden und nebenbei bearbeiten;Flexibilität, da es von überall aus gemacht werden kann und der Anwender selber entscheiden kann, wann er die Sessions absolviert;Ja;;Sehr typisch für mich;Eher typisch für mich;Eher typisch für mich;Ziemlich typisch für mich;Ziemlich typisch für mich;Eher typisch für mich;Ziemlich typisch für mich;Ziemlich typisch für mich;Sehr typisch für mich;Ziemlich typisch für mich;Ziemlich typisch für mich;Eher untypisch für mich;Eher untypisch für mich;Ziemlich typisch für mich;Ziemlich typisch für mich;Ziemlich typisch für mich;Eher typisch für mich;Ziemlich typisch für mich;Ziemlich typisch für mich;Eher untypisch für mich;Ziemlich untypisch für mich;Eher typisch für mich;Ziemlich typisch für mich;Eher typisch für mich;Ziemlich typisch für mich;Eher typisch für mich;Eher untypisch für mich;Ziemlich typisch für mich;Ziemlich typisch für mich;Ziemlich untypisch für mich;3;ausgewählt;ausgewählt;nicht gewählt;ausgewählt;4;ausgewählt;ausgewählt;ausgewählt;ausgewählt;2;ausgewählt;ausgewählt;nicht gewählt;nicht gewählt;3;nicht gewählt;ausgewählt;ausgewählt;ausgewählt;2;nicht gewählt;ausgewählt;ausgewählt;nicht gewählt;2;nicht gewählt;ausgewählt;ausgewählt;nicht gewählt;3;ausgewählt;ausgewählt;ausgewählt;nicht gewählt;3;ausgewählt;nicht gewählt;ausgewählt;ausgewählt;2;nicht gewählt;nicht gewählt;ausgewählt;ausgewählt;4;ausgewählt;ausgewählt;ausgewählt;ausgewählt;2;ausgewählt;nicht gewählt;ausgewählt;nicht gewählt;3;ausgewählt;ausgewählt;nicht gewählt;ausgewählt;3;ausgewählt;nicht gewählt;ausgewählt;ausgewählt;2;nicht gewählt;ausgewählt;nicht gewählt;ausgewählt;2;ausgewählt;ausgewählt;nicht gewählt;nicht gewählt;3;ausgewählt;ausgewählt;nicht gewählt;ausgewählt;VARK;14;10;8;11;;;;;;;1266;568.19;698.11;
base;männlich;21;;Germany;Sekundarschulabschluss;;Studierende/r;Rechts;ID05;LEARN-007;B;Kundenstammsatz verwalten;;Lieferantenstammsatz verwalten;;2;;ausgewählt;;nicht gewählt;;nicht gewählt;;nicht gewählt;;;;;;;;;;;;;;nicht gewählt;;nicht gewählt;;ausgewählt;;Vertriebsbereich;;Lieferantenabstimmkonto;;Verbindlichkeiten aus Lieferungen und Leistungen;;Übernehmen;;Oben links unter dem Namen des Kunden/Lieferanten;;Jeweilige Schaltfläche Buchungskreise, Rollen, Adressdetails;;"Schaltfläche ""Buchungskreisspezifische Daten""";;Ich stimme zu;;4;;Ich stimme zu;;Ich stimme nicht zu;;Ich stimme nicht zu;;Ich stimme zu;;Ich stimme zu;;Ich stimme zu;;4;;ausgewählt;;ausgewählt;;nicht gewählt;;nicht gewählt;;ausgewählt;;ausgewählt;;Ja;;Nein;;;;Ja;;Um sicherzustellen, dass zukünftige Nutzer das System verstanden haben.;;;;Präsenztraining;;Der Umgang mit einem System von Person zu Person kann sehr unterschiedlich sein, Training in Präsenz hat gegenüber E-Learning die Möglichkeit sehr hoher Individualität (durch die schulende Person).;;;;Ja;;Sehr typisch für mich;Sehr typisch für mich;Eher untypisch für mich;Eher typisch für mich;Eher untypisch für mich;Eher untypisch für mich;Ziemlich typisch für mich;Eher untypisch für mich;Sehr typisch für mich;Ziemlich typisch für mich;Eher untypisch für mich;Ziemlich typisch für mich;Eher untypisch für mich;Ziemlich typisch für mich;Sehr untypisch für mich;Ziemlich untypisch für mich;Ziemlich untypisch für mich;Eher typisch für mich;Sehr untypisch für mich;Ziemlich untypisch für mich;Ziemlich typisch für mich;Ziemlich typisch für mich;Eher typisch für mich;Eher untypisch für mich;Eher typisch für mich;Ziemlich untypisch für mich;Eher untypisch für mich;Eher typisch für mich;Eher typisch für mich;Eher untypisch für mich;1;nicht gewählt;ausgewählt;nicht gewählt;nicht gewählt;2;ausgewählt;nicht gewählt;ausgewählt;nicht gewählt;1;nicht gewählt;ausgewählt;nicht gewählt;nicht gewählt;2;nicht gewählt;ausgewählt;nicht gewählt;ausgewählt;1;nicht gewählt;nicht gewählt;ausgewählt;nicht gewählt;2;nicht gewählt;ausgewählt;ausgewählt;nicht gewählt;1;nicht gewählt;ausgewählt;nicht gewählt;nicht gewählt;1;nicht gewählt;nicht gewählt;ausgewählt;nicht gewählt;1;nicht gewählt;ausgewählt;nicht gewählt;nicht gewählt;2;ausgewählt;ausgewählt;nicht gewählt;nicht gewählt;3;ausgewählt;ausgewählt;ausgewählt;nicht gewählt;2;ausgewählt;ausgewählt;nicht gewählt;nicht gewählt;1;ausgewählt;nicht gewählt;nicht gewählt;nicht gewählt;1;ausgewählt;nicht gewählt;nicht gewählt;nicht gewählt;2;ausgewählt;nicht gewählt;ausgewählt;nicht gewählt;2;nicht gewählt;ausgewählt;nicht gewählt;ausgewählt;VARK;5;8;6;6;;;;;;;1248;702.34;546.05;
