base;männlich;23;;Germany;Abitur;;Studierende/r;Rechts;ID14;LEARN-018;A;Kundenstammsatz verwalten;;Lieferantenstammsatz verwalten;;1;;ausgewählt;;nicht gewählt;;nicht gewählt;;nicht gewählt;;nicht gewählt;;nicht gewählt;;1;;nicht gewählt;;nicht gewählt;;nicht gewählt;;nicht gewählt;;nicht gewählt;;ausgewählt;;Einkaufsbereich;;Bankkonto;;Bankkonto;;Übernehmen;;Oben links unter dem Namen des Kunden/Lieferanten;;Neu;;"Schaltfläche ""Anlegen""";;Ich stimme zu;;4;;Ich stimme zu;;2;;2;;Ich stimme zu;;Ich stimme zu;;4;;4;;ausgewählt;;ausgewählt;;nicht gewählt;;ausgewählt;;nicht gewählt;;ausgewählt;;Nein;;Nein;;;;Ja;;Weil die Programme wichtige Daten auf einer ansprechenden Benutzeroberfläche zusammenführt.;;;;Präsenztraining;;Weil alle Lernschritte mit allen anderen Teilnehmern zusammen besprochen werden können.;;;Jeder Mitarbeiter kann sich die Zeit frei einteilen und dort wo er Schwächen hat, sich vertiefen und evtl. etwas mehr Zeit investieren als bei einer Präsenzschulung. ;Nein;;Ziemlich untypisch für mich;Sehr typisch für mich;Eher typisch für mich;Eher untypisch für mich;Sehr typisch für mich;Eher typisch für mich;Ziemlich typisch für mich;Ziemlich typisch für mich;Sehr typisch für mich;Ziemlich untypisch für mich;Ziemlich typisch für mich;Ziemlich typisch für mich;Ziemlich untypisch für mich;Eher typisch für mich;Eher typisch für mich;Sehr typisch für mich;Ziemlich typisch für mich;Eher typisch für mich;Ziemlich typisch für mich;Eher untypisch für mich;Sehr typisch für mich;Ziemlich untypisch für mich;Ziemlich typisch für mich;Eher typisch für mich;Ziemlich typisch für mich;Eher untypisch für mich;Ziemlich untypisch für mich;Sehr typisch für mich;Ziemlich typisch für mich;Eher untypisch für mich;3;ausgewählt;ausgewählt;ausgewählt;nicht gewählt;1;ausgewählt;nicht gewählt;nicht gewählt;nicht gewählt;3;ausgewählt;ausgewählt;nicht gewählt;ausgewählt;4;ausgewählt;ausgewählt;ausgewählt;ausgewählt;1;nicht gewählt;ausgewählt;nicht gewählt;nicht gewählt;1;nicht gewählt;ausgewählt;nicht gewählt;nicht gewählt;1;ausgewählt;nicht gewählt;nicht gewählt;nicht gewählt;3;nicht gewählt;ausgewählt;ausgewählt;ausgewählt;2;nicht gewählt;ausgewählt;ausgewählt;nicht gewählt;3;ausgewählt;ausgewählt;ausgewählt;nicht gewählt;4;ausgewählt;ausgewählt;ausgewählt;ausgewählt;2;nicht gewählt;ausgewählt;ausgewählt;nicht gewählt;3;ausgewählt;ausgewählt;nicht gewählt;ausgewählt;3;ausgewählt;nicht gewählt;ausgewählt;ausgewählt;2;ausgewählt;nicht gewählt;ausgewählt;nicht gewählt;2;ausgewählt;nicht gewählt;ausgewählt;nicht gewählt;VARK;10;8;8;11;;;;;;;2155;1369.73;784.9;Datei beschädigt
base;männlich;24;;Germany;Bachelor Abschluss;;Studierende/r;Rechts;ID15;LEARN-019;B;Geschäftspartnerstammdaten verwalten;Kunde anlegen;Geschäftspartnerstammdaten verwalten;Lieferant anlegen;1;1;nicht gewählt;ausgewählt;ausgewählt;nicht gewählt;nicht gewählt;nicht gewählt;nicht gewählt;nicht gewählt;nicht gewählt;nicht gewählt;nicht gewählt;nicht gewählt;1;1;nicht gewählt;nicht gewählt;nicht gewählt;nicht gewählt;nicht gewählt;nicht gewählt;nicht gewählt;;nicht gewählt;;ausgewählt;;Vertriebswegsbereich;;Abstimmkonto;;Bankkonto;;Anwenden;;Oben rechts;;Jeweilige Schaltfläche Buchungskreise, Rollen, Adressdetails;;"Schaltfläche ""Buchungskreisspezifische Daten""";;4;;4;;4;;3;;2;;Ich stimme zu;;4;;4;;5;;ausgewählt;;ausgewählt;;ausgewählt;;nicht gewählt;;ausgewählt;;ausgewählt;;Ja;;Ja;;SAP;;Ja;;Endanwenderschulungen helfen bei der schnellen und einfachen Schulung der betroffenen Personen bzw. zukünftigen Nutzern. Die Personen können, sollte es sich um E-Learning handeln, im eigenen Tempo das Thema durcharbeiten;;;;E-Learning;;;;In diesem Fall sollten es besser in E-Learning gemacht werden, da man nur lernen kann, wenn man mit dem System selbst in Kontakt kommt bzw. sich daran ausprobieren kann. E-Learning hilft auch dabei, dass große Gruppen gleichzeitig geschult werden können;;Ja;;Ziemlich typisch für mich;Eher typisch für mich;Eher untypisch für mich;Ziemlich typisch für mich;Eher untypisch für mich;Eher typisch für mich;Eher typisch für mich;Eher typisch für mich;Ziemlich typisch für mich;Eher typisch für mich;Eher untypisch für mich;Eher typisch für mich;Eher untypisch für mich;Ziemlich typisch für mich;Eher typisch für mich;Sehr typisch für mich;Eher typisch für mich;Ziemlich typisch für mich;Eher untypisch für mich;Eher untypisch für mich;Eher typisch für mich;Eher untypisch für mich;Eher untypisch für mich;Eher typisch für mich;Eher typisch für mich;Eher untypisch für mich;Eher untypisch für mich;Eher untypisch für mich;Ziemlich typisch für mich;Eher untypisch für mich;2;ausgewählt;ausgewählt;nicht gewählt;nicht gewählt;2;ausgewählt;nicht gewählt;ausgewählt;nicht gewählt;2;ausgewählt;nicht gewählt;nicht gewählt;ausgewählt;2;ausgewählt;nicht gewählt;ausgewählt;nicht gewählt;0;nicht gewählt;nicht gewählt;nicht gewählt;nicht gewählt;3;ausgewählt;ausgewählt;ausgewählt;nicht gewählt;2;ausgewählt;ausgewählt;nicht gewählt;nicht gewählt;2;nicht gewählt;nicht gewählt;ausgewählt;ausgewählt;2;nicht gewählt;ausgewählt;ausgewählt;nicht gewählt;2;nicht gewählt;ausgewählt;ausgewählt;nicht gewählt;1;nicht gewählt;nicht gewählt;ausgewählt;nicht gewählt;1;ausgewählt;nicht gewählt;nicht gewählt;nicht gewählt;2;ausgewählt;ausgewählt;nicht gewählt;nicht gewählt;2;ausgewählt;nicht gewählt;ausgewählt;nicht gewählt;2;nicht gewählt;nicht gewählt;ausgewählt;ausgewählt;2;ausgewählt;nicht gewählt;nicht gewählt;ausgewählt;VARK;6;9;4;10;;;;;;;1213;655.23;557.57;Fehlermeldung, konnte nicht gespeichert werden
base;weiblich;26;;Germany;Abitur;;Studierende/r;Rechts;ID16;LEARN-020;A;Kunde anlegen;Kunde anlegen;Lieferant anlegen;Lieferant anlegen;1;2;nicht gewählt;ausgewählt;ausgewählt;nicht gewählt;nicht gewählt;nicht gewählt;nicht gewählt;nicht gewählt;nicht gewählt;ausgewählt;nicht gewählt;nicht gewählt;1;1;nicht gewählt;nicht gewählt;nicht gewählt;nicht gewählt;nicht gewählt;nicht gewählt;nicht gewählt;nicht gewählt;nicht gewählt;ausgewählt;ausgewählt;nicht gewählt;Vertriebsbereich;Kundenbereich;Verbindlichkeiten aus Lieferungen und Leistungen;Verbindlichkeiten aus Lieferungen und Leistungen;Bankkonto;Abstimmkonto;Anlegen;Anlegen;Oben links neben dem Namen des Kunden/Lieferanten;Oben links neben dem Namen des Kunden/Lieferanten;Anlegen;Jeweilige Schaltfläche Buchungskreise, Rollen, Adressdetails;Pfeil am Ende der Zeile;Pfeil am Ende der Zeile;Ich stimme zu;Ich stimme zu;4;4;Ich stimme zu;4;Ich stimme nicht zu;3;Ich stimme nicht zu;2;Ich stimme zu;4;4;4;Ich stimme zu;3;4;3;nicht gewählt;ausgewählt;ausgewählt;nicht gewählt;ausgewählt;nicht gewählt;nicht gewählt;nicht gewählt;ausgewählt;ausgewählt;ausgewählt;ausgewählt;Ja;Ja;Ja;;SAP;;Ja;Ja;Besseres Verständnis für die Prozesse.;Effektives Lernen;;;E-Learning;E-Learning;;;Learning by Doing.;;Ja;Ja;Sehr typisch für mich;Ziemlich typisch für mich;Ziemlich typisch für mich;Ziemlich typisch für mich;Ziemlich typisch für mich;Ziemlich typisch für mich;Sehr typisch für mich;Eher untypisch für mich;Sehr typisch für mich;Eher untypisch für mich;Eher untypisch für mich;Ziemlich typisch für mich;Sehr typisch für mich;Ziemlich typisch für mich;Eher typisch für mich;Sehr typisch für mich;Eher untypisch für mich;Eher typisch für mich;Ziemlich typisch für mich;Ziemlich typisch für mich;Ziemlich typisch für mich;Ziemlich typisch für mich;Eher untypisch für mich;Sehr typisch für mich;Ziemlich typisch für mich;Ziemlich typisch für mich;Eher untypisch für mich;Eher untypisch für mich;Sehr typisch für mich;Ziemlich untypisch für mich;1;nicht gewählt;ausgewählt;nicht gewählt;nicht gewählt;2;ausgewählt;nicht gewählt;ausgewählt;nicht gewählt;1;ausgewählt;nicht gewählt;nicht gewählt;nicht gewählt;1;nicht gewählt;nicht gewählt;ausgewählt;nicht gewählt;1;ausgewählt;nicht gewählt;nicht gewählt;nicht gewählt;2;nicht gewählt;ausgewählt;ausgewählt;nicht gewählt;3;ausgewählt;ausgewählt;ausgewählt;nicht gewählt;2;ausgewählt;nicht gewählt;ausgewählt;nicht gewählt;2;nicht gewählt;ausgewählt;ausgewählt;nicht gewählt;1;nicht gewählt;ausgewählt;nicht gewählt;nicht gewählt;1;nicht gewählt;nicht gewählt;ausgewählt;nicht gewählt;2;nicht gewählt;ausgewählt;nicht gewählt;ausgewählt;2;ausgewählt;nicht gewählt;nicht gewählt;ausgewählt;2;nicht gewählt;nicht gewählt;ausgewählt;ausgewählt;2;ausgewählt;nicht gewählt;nicht gewählt;ausgewählt;2;ausgewählt;ausgewählt;nicht gewählt;nicht gewählt;VARK;9;8;4;6;PDF;PDF;Das Video war teilweise zu schnell, es musste des Öfteren pausiert werden. Die Anleitung in dem PDF konnte im eigenen Tempo abgearbeitet werden.;Es war gut so wie es war.;Langsamere Mausbewegungen.;Learning by Doing und routinierte Prozesse.;1390;636.29;754.05;Fehlermeldung, konnte nicht gespeichert werden
base;männlich;29;;Germany;Master Abschluss;;Angestellte/r;Rechts;ID17;LEARN-021;B;Geschäftspartnerstammdaten verwalten;;Kreditor anlegen;;4;;nicht gewählt;;nicht gewählt;;ausgewählt;;ausgewählt;;ausgewählt;;ausgewählt;;4;;ausgewählt;;ausgewählt;;ausgewählt;;ausgewählt;;nicht gewählt;;nicht gewählt;;Vertriebsbereich;;Verbindlichkeiten aus Lieferungen und Leistungen;;Forderungen aus Lieferungen und Leistungen;;Anlegen;;Oben links neben dem Namen des Kunden/Lieferanten;;Jeweilige Schaltfläche Buchungskreise, Rollen, Adressdetails;;"Schaltfläche ""Buchungskreisspezifische Daten""";;Ich stimme zu;;Ich stimme nicht zu;;4;;4;;Ich stimme nicht zu;;4;;4;;4;;6;;ausgewählt;;ausgewählt;;ausgewählt;;ausgewählt;;ausgewählt;;ausgewählt;;Ja;;Ja;;SAP Hana 4;;Ja;;Man lernt ein System kennen, mit dem man arbeiten muss;;;;Präsenztraining;;Es bleibt mehr hängen;;;Flexiblel, individuelles Lernen, individuelles Tempo;Ja;;Eher typisch für mich;Eher typisch für mich;Eher typisch für mich;Ziemlich typisch für mich;Sehr typisch für mich;Sehr typisch für mich;Ziemlich typisch für mich;Sehr typisch für mich;Sehr typisch für mich;Ziemlich typisch für mich;Ziemlich typisch für mich;Ziemlich untypisch für mich;Ziemlich typisch für mich;Sehr typisch für mich;Ziemlich typisch für mich;Sehr typisch für mich;Sehr typisch für mich;Sehr typisch für mich;Ziemlich typisch für mich;Ziemlich typisch für mich;Eher typisch für mich;Sehr typisch für mich;Ziemlich typisch für mich;Ziemlich typisch für mich;Ziemlich typisch für mich;Ziemlich typisch für mich;Eher typisch für mich;Eher typisch für mich;Ziemlich typisch für mich;Ziemlich untypisch für mich;1;nicht gewählt;ausgewählt;nicht gewählt;nicht gewählt;4;ausgewählt;ausgewählt;ausgewählt;ausgewählt;1;ausgewählt;nicht gewählt;nicht gewählt;nicht gewählt;2;nicht gewählt;nicht gewählt;ausgewählt;ausgewählt;2;nicht gewählt;ausgewählt;ausgewählt;nicht gewählt;1;nicht gewählt;ausgewählt;nicht gewählt;nicht gewählt;1;nicht gewählt;ausgewählt;nicht gewählt;nicht gewählt;4;ausgewählt;ausgewählt;ausgewählt;ausgewählt;2;nicht gewählt;ausgewählt;ausgewählt;nicht gewählt;4;ausgewählt;ausgewählt;ausgewählt;ausgewählt;3;nicht gewählt;ausgewählt;ausgewählt;ausgewählt;1;nicht gewählt;nicht gewählt;nicht gewählt;ausgewählt;4;ausgewählt;ausgewählt;ausgewählt;ausgewählt;4;ausgewählt;ausgewählt;ausgewählt;ausgewählt;4;ausgewählt;ausgewählt;ausgewählt;ausgewählt;4;ausgewählt;ausgewählt;ausgewählt;ausgewählt;VARK;9;11;10;12;;;;;;;1579;736.51;842.11;
base;männlich;30;;Germany;Master Abschluss;;Angestellte/r;Rechts;ID18;LEARN-022;A;Kunde anlegen;Kunde anlegen;Lieferant anlegen;Lieferant anlegen;2;4;nicht gewählt;ausgewählt;ausgewählt;ausgewählt;nicht gewählt;nicht gewählt;nicht gewählt;nicht gewählt;nicht gewählt;ausgewählt;ausgewählt;ausgewählt;2;3;ausgewählt;ausgewählt;nicht gewählt;ausgewählt;nicht gewählt;nicht gewählt;ausgewählt;nicht gewählt;nicht gewählt;ausgewählt;nicht gewählt;nicht gewählt;Vertriebsbereich;Vertriebsbereich;Lieferantenabstimmkonto;Abstimmkonto;Kundenabstimmkonto;Abstimmkonto;Übernehmen;Anwenden;Oben links unter dem Namen des Kunden/Lieferanten;Oben rechts;Anlegen;Anlegen;"Schaltfläche ""Buchungskreisspezifische Daten""";"Schaltfläche ""Anlegen""";Ich stimme zu;Ich stimme zu;4;3;2;4;2;3;2;2;Ich stimme zu;Ich stimme zu;Ich stimme zu;Ich stimme zu;4;4;3;2;ausgewählt;ausgewählt;ausgewählt;ausgewählt;nicht gewählt;nicht gewählt;ausgewählt;nicht gewählt;nicht gewählt;nicht gewählt;nicht gewählt;nicht gewählt;Ja;Ja;Nein;;;;Ja;Ja;Insbesondere für unerfahrene Anwender ist eine Instruktion hilfreich;Weil die Anwendungen auf den ersten Blick nicht sehr intuitiv sind;;;E-Learning;E-Learning;;;Softwareschulungen on-device können im E-Learning gezielter umgesetzt werden;;Nein;Nein;Sehr typisch für mich;Sehr typisch für mich;Eher typisch für mich;Ziemlich typisch für mich;Eher typisch für mich;Ziemlich typisch für mich;Ziemlich typisch für mich;Eher typisch für mich;Sehr typisch für mich;Ziemlich typisch für mich;Ziemlich typisch für mich;Ziemlich typisch für mich;Ziemlich untypisch für mich;Sehr typisch für mich;Ziemlich untypisch für mich;Sehr typisch für mich;Eher typisch für mich;Sehr typisch für mich;Eher untypisch für mich;Eher untypisch für mich;Ziemlich typisch für mich;Ziemlich typisch für mich;Eher typisch für mich;Eher typisch für mich;Ziemlich typisch für mich;Eher typisch für mich;Ziemlich typisch für mich;Ziemlich typisch für mich;Ziemlich typisch für mich;Ziemlich untypisch für mich;2;nicht gewählt;ausgewählt;ausgewählt;nicht gewählt;1;ausgewählt;nicht gewählt;nicht gewählt;nicht gewählt;1;ausgewählt;nicht gewählt;nicht gewählt;nicht gewählt;1;ausgewählt;nicht gewählt;nicht gewählt;nicht gewählt;1;nicht gewählt;ausgewählt;nicht gewählt;nicht gewählt;1;nicht gewählt;nicht gewählt;ausgewählt;nicht gewählt;1;ausgewählt;nicht gewählt;nicht gewählt;nicht gewählt;1;nicht gewählt;nicht gewählt;ausgewählt;nicht gewählt;1;nicht gewählt;nicht gewählt;ausgewählt;nicht gewählt;1;nicht gewählt;ausgewählt;nicht gewählt;nicht gewählt;1;ausgewählt;nicht gewählt;nicht gewählt;nicht gewählt;1;nicht gewählt;nicht gewählt;ausgewählt;nicht gewählt;1;ausgewählt;nicht gewählt;nicht gewählt;nicht gewählt;1;ausgewählt;nicht gewählt;nicht gewählt;nicht gewählt;1;nicht gewählt;nicht gewählt;ausgewählt;nicht gewählt;1;nicht gewählt;ausgewählt;nicht gewählt;nicht gewählt;VK;6;3;2;6;PDF;Video;Beim Video kann man parallel zum Abspielen die Schritte befolgen. Man ist so schneller mit der Aufgabe fertig. ABER man führt so nur aus und denkt nicht nach. Der Lerneffekt ist bei der PDF größer;Dymaschi klickbares Dokument, um Scrollen zu reduzieren; - ;Ggf wäre es sinnvoll, die Videos in einzelne Arbeitsschritte aufzuteilen. So kann man sich den Teil des Videos aufmerksam ansehen und danach die Aufgabe erledigen;2037;988.67;1048.45;
base;weiblich;25;;Germany;Abitur;;Studierende/r;Rechts;ID19;LEARN-023;;;;;;;;;;;;;;;;;;;;;;;;;;;;nicht gewählt;nicht gewählt;nicht gewählt;nicht gewählt;ausgewählt;ausgewählt;Vertriebswegsbereich;Kundenbereich;Lieferantenabstimmkonto;Verbindlichkeiten aus Lieferungen und Leistungen;Kundenabstimmkonto;Verbindlichkeiten aus Lieferungen und Leistungen;Übernehmen;Übernehmen;Oben links unter dem Namen des Kunden/Lieferanten;Oben links unter dem Namen des Kunden/Lieferanten;Jeweilige Schaltfläche Buchungskreise, Rollen, Adressdetails;Anlegen;"Schaltfläche ""Buchungskreisspezifische Daten""";Pfeil am Ende der Zeile;4;Ich stimme zu;2;3;Ich stimme zu;Ich stimme zu;4;3;3;2;Ich stimme zu;Ich stimme zu;Ich stimme zu;Ich stimme zu;3;3;3;4;nicht gewählt;ausgewählt;ausgewählt;ausgewählt;nicht gewählt;nicht gewählt;nicht gewählt;ausgewählt;ausgewählt;nicht gewählt;ausgewählt;ausgewählt;Ja;Ja;Nein;;;;Ja;Ja;Es ist immer nützlich in die Programme eingewiesen zu werden, auch schon Wissen vertrauter Personen aufzufrischen.;-;;;Präsenztraining;Präsenztraining;Falls etwas mal nicht klappt, kann man direkt vorort Hilfe erhalten uns sich mit den anderen Teilnehmern austauschen.;-;;da man so direkt in einem Anwendungssetting lernen kann;Nein;Nein;Eher typisch für mich;Ziemlich typisch für mich;Eher typisch für mich;Eher typisch für mich;Ziemlich untypisch für mich;Ziemlich typisch für mich;Ziemlich untypisch für mich;Eher untypisch für mich;Ziemlich typisch für mich;Sehr typisch für mich;Ziemlich typisch für mich;Eher typisch für mich;Ziemlich typisch für mich;Ziemlich typisch für mich;Sehr untypisch für mich;Eher untypisch für mich;Eher typisch für mich;Ziemlich untypisch für mich;Ziemlich typisch für mich;Ziemlich untypisch für mich;Ziemlich untypisch für mich;Sehr typisch für mich;Eher untypisch für mich;Ziemlich untypisch für mich;Eher typisch für mich;Sehr typisch für mich;Ziemlich untypisch für mich;Eher untypisch für mich;Eher untypisch für mich;Sehr untypisch für mich;2;ausgewählt;ausgewählt;nicht gewählt;nicht gewählt;2;ausgewählt;nicht gewählt;nicht gewählt;ausgewählt;1;ausgewählt;nicht gewählt;nicht gewählt;nicht gewählt;3;nicht gewählt;ausgewählt;ausgewählt;ausgewählt;1;ausgewählt;nicht gewählt;nicht gewählt;nicht gewählt;2;ausgewählt;ausgewählt;nicht gewählt;nicht gewählt;2;ausgewählt;nicht gewählt;ausgewählt;nicht gewählt;4;ausgewählt;ausgewählt;ausgewählt;ausgewählt;1;nicht gewählt;nicht gewählt;ausgewählt;nicht gewählt;2;nicht gewählt;ausgewählt;nicht gewählt;ausgewählt;2;nicht gewählt;nicht gewählt;ausgewählt;ausgewählt;1;nicht gewählt;ausgewählt;nicht gewählt;nicht gewählt;2;ausgewählt;nicht gewählt;nicht gewählt;ausgewählt;1;ausgewählt;nicht gewählt;nicht gewählt;nicht gewählt;2;ausgewählt;nicht gewählt;ausgewählt;nicht gewählt;1;nicht gewählt;ausgewählt;nicht gewählt;nicht gewählt;kinästhethisches Lernen;6;6;5;11;Video;PDF;;-;-;-;1756;918.91;836.86;
base;männlich;19;;Germany;Abitur;;Studierende/r;Rechts;ID20;LEARN-024;A;Kunde anlegen;Kundenstammsatz verwalten;Lieferant anlegen;Lieferant anlegen;2;;ausgewählt;;ausgewählt;;nicht gewählt;;nicht gewählt;;nicht gewählt;;nicht gewählt;;2;;nicht gewählt;;nicht gewählt;;nicht gewählt;;nicht gewählt;;ausgewählt;;ausgewählt;;Kundenbereich;;Lieferantenabstimmkonto;;Kundenabstimmkonto;;Übernehmen;;Oben rechts;;Neu;;"Schaltfläche ""Anlegen""";;Ich stimme zu;;3;;4;;3;;Ich stimme nicht zu;;Ich stimme zu;;Ich stimme zu;;Ich stimme zu;;6;;ausgewählt;;ausgewählt;;ausgewählt;;ausgewählt;;ausgewählt;;ausgewählt;;Nein;;Nein;;;;Ja;;Um Daten für betriebliche Funktionen besser bereitgestellt werden kann;;;;E-Learning;;;;so ist es für viele teilnehmer flexibeler;;Nein;;Sehr typisch für mich;Ziemlich typisch für mich;Eher untypisch für mich;Eher typisch für mich;Ziemlich typisch für mich;Ziemlich typisch für mich;Eher typisch für mich;Ziemlich typisch für mich;Sehr typisch für mich;Ziemlich untypisch für mich;Eher typisch für mich;Ziemlich typisch für mich;Eher untypisch für mich;Sehr typisch für mich;Eher typisch für mich;Sehr typisch für mich;Eher untypisch für mich;Eher typisch für mich;Eher typisch für mich;Ziemlich untypisch für mich;Ziemlich untypisch für mich;Ziemlich typisch für mich;Sehr typisch für mich;Eher typisch für mich;Eher untypisch für mich;Eher untypisch für mich;Ziemlich untypisch für mich;Ziemlich untypisch für mich;Sehr typisch für mich;Sehr untypisch für mich;1;nicht gewählt;ausgewählt;nicht gewählt;nicht gewählt;1;nicht gewählt;ausgewählt;nicht gewählt;nicht gewählt;1;ausgewählt;nicht gewählt;nicht gewählt;nicht gewählt;3;ausgewählt;nicht gewählt;ausgewählt;ausgewählt;1;ausgewählt;nicht gewählt;nicht gewählt;nicht gewählt;2;ausgewählt;ausgewählt;nicht gewählt;nicht gewählt;1;ausgewählt;nicht gewählt;nicht gewählt;nicht gewählt;3;ausgewählt;nicht gewählt;ausgewählt;ausgewählt;1;ausgewählt;nicht gewählt;nicht gewählt;nicht gewählt;1;nicht gewählt;ausgewählt;nicht gewählt;nicht gewählt;2;nicht gewählt;ausgewählt;ausgewählt;nicht gewählt;1;ausgewählt;nicht gewählt;nicht gewählt;nicht gewählt;3;ausgewählt;nicht gewählt;ausgewählt;ausgewählt;2;nicht gewählt;ausgewählt;ausgewählt;nicht gewählt;1;nicht gewählt;nicht gewählt;nicht gewählt;ausgewählt;2;ausgewählt;nicht gewählt;nicht gewählt;ausgewählt;VARK;6;7;7;6;;;;;;;2527;1971.07;556.03;
base;weiblich;24;;Germany;Abgeschlossene Berufsausbildung;;Angestellte/r;Rechts;ID21;LEARN-025;B;Kundenstammsatz verwalten;;Lieferantenstammsatz verwalten;;1;2;nicht gewählt;ausgewählt;nicht gewählt;nicht gewählt;ausgewählt;nicht gewählt;nicht gewählt;nicht gewählt;nicht gewählt;ausgewählt;nicht gewählt;nicht gewählt;1;2;ausgewählt;nicht gewählt;nicht gewählt;ausgewählt;nicht gewählt;nicht gewählt;nicht gewählt;nicht gewählt;nicht gewählt;nicht gewählt;nicht gewählt;ausgewählt;Einkaufsbereich;Kundenbereich;Forderungen aus Lieferungen und Leistungen;Lieferantenabstimmkonto;Kundenabstimmkonto;Forderungen aus Lieferungen und Leistungen;Anlegen;Anlegen;Oben rechts;Oben links unter dem Namen des Kunden/Lieferanten;Anlegen;Anlegen;Plus am Ende der Zeile;Plus am Ende der Zeile;Ich stimme zu;4;4;Ich stimme zu;4;4;4;2;2;3;Ich stimme zu;Ich stimme zu;4;Ich stimme zu;Ich stimme nicht zu;4;3;5;nicht gewählt;ausgewählt;ausgewählt;ausgewählt;nicht gewählt;ausgewählt;nicht gewählt;ausgewählt;ausgewählt;nicht gewählt;ausgewählt;ausgewählt;Nein;Ja;Nein;;;;Ja;Ja;ist praktisch;Die müssen schließlich im Arbeitsalltag damit umgehen können ;;;E-Learning;E-Learning;;;ist idividueller;;Nein;Nein;Eher untypisch für mich;Ziemlich typisch für mich;Eher typisch für mich;Eher typisch für mich;Ziemlich typisch für mich;Ziemlich untypisch für mich;Eher untypisch für mich;Eher typisch für mich;Ziemlich typisch für mich;Ziemlich untypisch für mich;Eher typisch für mich;Ziemlich typisch für mich;Eher typisch für mich;Ziemlich typisch für mich;Ziemlich untypisch für mich;Sehr typisch für mich;Ziemlich typisch für mich;Eher typisch für mich;Eher typisch für mich;Sehr typisch für mich;Eher typisch für mich;Eher untypisch für mich;Eher untypisch für mich;Ziemlich typisch für mich;Ziemlich untypisch für mich;Eher typisch für mich;Ziemlich typisch für mich;Eher typisch für mich;Ziemlich typisch für mich;Sehr untypisch für mich;1;nicht gewählt;ausgewählt;nicht gewählt;nicht gewählt;2;ausgewählt;ausgewählt;nicht gewählt;nicht gewählt;2;ausgewählt;ausgewählt;nicht gewählt;nicht gewählt;1;nicht gewählt;nicht gewählt;ausgewählt;nicht gewählt;1;nicht gewählt;ausgewählt;nicht gewählt;nicht gewählt;1;nicht gewählt;nicht gewählt;ausgewählt;nicht gewählt;2;ausgewählt;ausgewählt;nicht gewählt;nicht gewählt;2;nicht gewählt;nicht gewählt;ausgewählt;ausgewählt;1;nicht gewählt;nicht gewählt;ausgewählt;nicht gewählt;1;nicht gewählt;ausgewählt;nicht gewählt;nicht gewählt;1;nicht gewählt;nicht gewählt;nicht gewählt;ausgewählt;1;nicht gewählt;nicht gewählt;nicht gewählt;ausgewählt;1;ausgewählt;nicht gewählt;nicht gewählt;nicht gewählt;2;ausgewählt;nicht gewählt;ausgewählt;nicht gewählt;2;ausgewählt;nicht gewählt;nicht gewählt;ausgewählt;1;nicht gewählt;nicht gewählt;nicht gewählt;ausgewählt;VK;8;5;0;9;PDF;Video;Ich musste weniger selbstständig suchen, um richtige Buttons zu finden im unbekannten Programm;fällt mir nichts zu ein;Ton mit kurzer Beschreibung was passiert;Video Lehrvideo mit Möglichkeit einer realen Person fragen zu stellen;3149;1559.94;1588.82;Fehlermeldung, konnte nicht gespeichert werden
