base;männlich;20;;Germany;Abitur;;Studierende/r;Links;ID06;LEARN-008;A;Kunde anlegen;;Lieferant anlegen;;3;;ausgewählt;;ausgewählt;;nicht gewählt;;nicht gewählt;;ausgewählt;nicht gewählt;nicht gewählt;nicht gewählt;2;1;nicht gewählt;ausgewählt;nicht gewählt;nicht gewählt;nicht gewählt;nicht gewählt;nicht gewählt;;ausgewählt;;ausgewählt;;Vertriebsbereich;;Lieferantenabstimmkonto;;Kundenabstimmkonto;;Übernehmen;;Oben links neben dem Namen des Kunden/Lieferanten;;Jeweilige Schaltfläche Buchungskreise, Rollen, Adressdetails;;"Schaltfläche ""Anlegen""";;Ich stimme zu;;4;;Ich stimme zu;;3;;2;;4;;Ich stimme zu;;Ich stimme zu;;4;;nicht gewählt;;ausgewählt;;ausgewählt;;nicht gewählt;;ausgewählt;;ausgewählt;;Ja;;Ja;;SAP, Salesforce;;Ja;;Jeder benötigt ein Einführung besonders bei komplexen neuen Systemen;;;;E-Learning;;;;Da jeder seinen Zeitplan selbst festlegen kann und flexibel ist;;Ja;;Eher typisch für mich;Ziemlich typisch für mich;Eher untypisch für mich;Sehr typisch für mich;Sehr typisch für mich;Eher untypisch für mich;Ziemlich typisch für mich;Ziemlich typisch für mich;Sehr typisch für mich;Eher typisch für mich;Sehr typisch für mich;Ziemlich typisch für mich;Ziemlich untypisch für mich;Sehr typisch für mich;Sehr typisch für mich;Sehr typisch für mich;Sehr typisch für mich;Sehr typisch für mich;Eher untypisch für mich;Ziemlich typisch für mich;Ziemlich untypisch für mich;Eher untypisch für mich;Eher untypisch für mich;Sehr typisch für mich;Ziemlich typisch für mich;Eher typisch für mich;Sehr typisch für mich;Eher typisch für mich;Sehr typisch für mich;Ziemlich typisch für mich;1;nicht gewählt;ausgewählt;nicht gewählt;nicht gewählt;2;ausgewählt;ausgewählt;nicht gewählt;nicht gewählt;1;nicht gewählt;nicht gewählt;nicht gewählt;ausgewählt;1;ausgewählt;nicht gewählt;nicht gewählt;nicht gewählt;1;nicht gewählt;ausgewählt;nicht gewählt;nicht gewählt;1;nicht gewählt;nicht gewählt;ausgewählt;nicht gewählt;2;ausgewählt;nicht gewählt;ausgewählt;nicht gewählt;1;nicht gewählt;nicht gewählt;nicht gewählt;ausgewählt;2;nicht gewählt;ausgewählt;ausgewählt;nicht gewählt;2;ausgewählt;ausgewählt;nicht gewählt;nicht gewählt;2;nicht gewählt;nicht gewählt;ausgewählt;ausgewählt;2;ausgewählt;nicht gewählt;ausgewählt;nicht gewählt;2;ausgewählt;nicht gewählt;nicht gewählt;ausgewählt;2;ausgewählt;nicht gewählt;ausgewählt;nicht gewählt;1;ausgewählt;nicht gewählt;nicht gewählt;nicht gewählt;3;ausgewählt;ausgewählt;nicht gewählt;ausgewählt;VAK;9;8;0;9;;;;;;;1165;530.94;634.11;
base;männlich;25;;Germany;Abitur;;Studierende/r;Rechts;ID07;LEARN-009;B;Geschäftspartnerstammdaten verwalten;;Geschäftspartnerstammdaten verwalten;;1;;ausgewählt;;nicht gewählt;;nicht gewählt;;nicht gewählt;;;;;;;;;;;;;;nicht gewählt;;nicht gewählt;;nicht gewählt;;Vertriebsbereich;;Forderungen aus Lieferungen und Leistungen;;Forderungen aus Lieferungen und Leistungen;;Übernehmen;;Oben links unter dem Namen des Kunden/Lieferanten;;Jeweilige Schaltfläche Buchungskreise, Rollen, Adressdetails;;"Schaltfläche ""Buchungskreisspezifische Daten""";;Ich stimme zu;;4;;Ich stimme zu;;2;;Ich stimme nicht zu;;Ich stimme zu;;Ich stimme zu;;4;;3;;ausgewählt;;ausgewählt;;ausgewählt;;nicht gewählt;;nicht gewählt;;nicht gewählt;;Ja;;Nein;;;;Ja;;Systeme werden immer komplexer, auch in ihrer Benutzung.;;;;E-Learning;;;;Flexibilität;;Nein;;Eher untypisch für mich;Eher typisch für mich;Eher untypisch für mich;Eher untypisch für mich;Eher typisch für mich;Ziemlich untypisch für mich;Eher untypisch für mich;Ziemlich typisch für mich;Eher typisch für mich;Eher untypisch für mich;Eher typisch für mich;Eher untypisch für mich;Eher untypisch für mich;Ziemlich typisch für mich;Eher untypisch für mich;Eher typisch für mich;Eher typisch für mich;Eher untypisch für mich;Eher untypisch für mich;Eher untypisch für mich;Eher typisch für mich;Eher typisch für mich;Eher typisch für mich;Eher untypisch für mich;Sehr typisch für mich;Eher untypisch für mich;Eher untypisch für mich;Eher typisch für mich;Ziemlich typisch für mich;Ziemlich untypisch für mich;1;nicht gewählt;ausgewählt;nicht gewählt;nicht gewählt;1;nicht gewählt;nicht gewählt;nicht gewählt;ausgewählt;1;ausgewählt;nicht gewählt;nicht gewählt;nicht gewählt;1;nicht gewählt;nicht gewählt;nicht gewählt;ausgewählt;1;nicht gewählt;nicht gewählt;ausgewählt;nicht gewählt;1;nicht gewählt;nicht gewählt;ausgewählt;nicht gewählt;1;ausgewählt;nicht gewählt;nicht gewählt;nicht gewählt;1;nicht gewählt;nicht gewählt;ausgewählt;nicht gewählt;1;nicht gewählt;nicht gewählt;ausgewählt;nicht gewählt;1;nicht gewählt;ausgewählt;nicht gewählt;nicht gewählt;3;ausgewählt;ausgewählt;ausgewählt;nicht gewählt;3;nicht gewählt;ausgewählt;ausgewählt;ausgewählt;1;ausgewählt;nicht gewählt;nicht gewählt;nicht gewählt;1;nicht gewählt;nicht gewählt;ausgewählt;nicht gewählt;1;nicht gewählt;nicht gewählt;ausgewählt;nicht gewählt;2;ausgewählt;ausgewählt;nicht gewählt;nicht gewählt;kinästhethisches Lernen;5;5;4;7;;;;;;;1324;692.352;631.94;
base;weiblich;20;;Germany;Abitur;;Studierende/r;Rechts;ID08;LEARN-010;A;Kunde anlegen;Kunde anlegen;Lieferantenstammsatz verwalten;Lieferant anlegen;2;1;ausgewählt;nicht gewählt;nicht gewählt;nicht gewählt;ausgewählt;nicht gewählt;nicht gewählt;nicht gewählt;nicht gewählt;nicht gewählt;nicht gewählt;ausgewählt;2;1;nicht gewählt;ausgewählt;nicht gewählt;nicht gewählt;nicht gewählt;nicht gewählt;ausgewählt;nicht gewählt;nicht gewählt;nicht gewählt;ausgewählt;nicht gewählt;Kundenbereich;Vertriebswegsbereich;Lieferantenabstimmkonto;Lieferantenabstimmkonto;Kundenabstimmkonto;Kundenabstimmkonto;Anwenden;Anwenden;Oben links neben dem Namen des Kunden/Lieferanten;Oben links neben dem Namen des Kunden/Lieferanten;Jeweilige Schaltfläche Buchungskreise, Rollen, Adressdetails;Hinzufügen;"Schaltfläche ""Buchungskreisspezifische Daten""";Pfeil am Ende der Zeile;Ich stimme zu;Ich stimme zu;4;3;Ich stimme zu;Ich stimme zu;4;4;2;4;Ich stimme zu;Ich stimme zu;Ich stimme zu;Ich stimme zu;Ich stimme zu;Ich stimme zu;6;4;ausgewählt;ausgewählt;ausgewählt;ausgewählt;ausgewählt;nicht gewählt;ausgewählt;nicht gewählt;ausgewählt;ausgewählt;ausgewählt;ausgewählt;Nein;Nein;Nein;;;;Ja;Ja;da es die Anwendung deutlich erleichtert und somit weniger fehler geacht werden;Es ist wichtig, dass die Personen wirklich genau wissen wie sie arbeiten sollen;;;Präsenztraining;Präsenztraining;da man im e-learning mehr angst hat zu fragen;Bevorzuge es einfach, da man fragen stellen kann auch untereinander und es sozial angenehmer und lustiger ist ;;;Nein;Ja;Eher typisch für mich;Ziemlich untypisch für mich;Ziemlich typisch für mich;Ziemlich typisch für mich;Eher untypisch für mich;Eher untypisch für mich;Eher untypisch für mich;Sehr typisch für mich;Sehr typisch für mich;Eher typisch für mich;Sehr typisch für mich;Ziemlich typisch für mich;Sehr untypisch für mich;Ziemlich typisch für mich;Eher typisch für mich;Eher typisch für mich;Eher typisch für mich;Ziemlich untypisch für mich;Ziemlich typisch für mich;Ziemlich untypisch für mich;Sehr untypisch für mich;Eher typisch für mich;Sehr typisch für mich;Eher typisch für mich;Ziemlich typisch für mich;Eher untypisch für mich;Eher typisch für mich;Sehr typisch für mich;Ziemlich typisch für mich;Eher typisch für mich;1;nicht gewählt;ausgewählt;nicht gewählt;nicht gewählt;4;ausgewählt;ausgewählt;ausgewählt;ausgewählt;2;nicht gewählt;nicht gewählt;ausgewählt;ausgewählt;2;ausgewählt;nicht gewählt;ausgewählt;nicht gewählt;2;nicht gewählt;ausgewählt;nicht gewählt;ausgewählt;2;nicht gewählt;ausgewählt;ausgewählt;nicht gewählt;4;ausgewählt;ausgewählt;ausgewählt;ausgewählt;2;nicht gewählt;ausgewählt;ausgewählt;nicht gewählt;2;nicht gewählt;nicht gewählt;ausgewählt;ausgewählt;3;ausgewählt;ausgewählt;ausgewählt;nicht gewählt;4;ausgewählt;ausgewählt;ausgewählt;ausgewählt;1;nicht gewählt;nicht gewählt;nicht gewählt;ausgewählt;3;ausgewählt;nicht gewählt;ausgewählt;ausgewählt;2;ausgewählt;nicht gewählt;ausgewählt;nicht gewählt;2;nicht gewählt;nicht gewählt;ausgewählt;ausgewählt;2;ausgewählt;nicht gewählt;nicht gewählt;ausgewählt;VARK;11;7;9;11;PDF;PDF;Bei einem fehler kann man schnell wieder auf den richtigen weg geleitet werden, da man schneller findet, wo man gerade war;Bunte dicke schrift ;"Mit dem kleinen etappen wie bei den yt videos ""einleitung, produkt A, produkt B,..""";Möglichkeit immer wiedrr darauf zugreifen zu können ;3272;1895.81;1376;Fehlermeldung, konnte nicht gespeichert werden
base;männlich;23;;Turkey;Abitur;;Studierende/r;Rechts;ID09;LEARN-011;B;Kundenstammsatz verwalten;;Lieferantenstammsatz verwalten;;1;;ausgewählt;;nicht gewählt;;nicht gewählt;;nicht gewählt;;nicht gewählt;;nicht gewählt;;1;;nicht gewählt;;nicht gewählt;;nicht gewählt;;nicht gewählt;;nicht gewählt;;ausgewählt;;Vertriebsbereich;;Verbindlichkeiten aus Lieferungen und Leistungen;;Forderungen aus Lieferungen und Leistungen;;Anlegen;;Unten Rechts;;Jeweilige Schaltfläche Buchungskreise, Rollen, Adressdetails;;"Schaltfläche ""Buchungskreisspezifische Daten""";;4;;3;;4;;4;;2;;Ich stimme zu;;Ich stimme zu;;3;;3;;ausgewählt;;ausgewählt;;nicht gewählt;;nicht gewählt;;nicht gewählt;;ausgewählt;;Ja;;Ja;;TS410;;Ja;;weil man erste erfahrungen mit der software macht;;;;Präsenztraining;;abstimmung von Lernen und zuhause chillen besser;;;;Ja;;Ziemlich typisch für mich;Sehr typisch für mich;Eher untypisch für mich;Ziemlich typisch für mich;Eher untypisch für mich;Eher typisch für mich;Eher typisch für mich;Ziemlich typisch für mich;Sehr typisch für mich;Eher typisch für mich;Eher typisch für mich;Ziemlich untypisch für mich;Eher untypisch für mich;Ziemlich typisch für mich;Eher untypisch für mich;Sehr typisch für mich;Sehr typisch für mich;Eher typisch für mich;Eher typisch für mich;Ziemlich untypisch für mich;Ziemlich typisch für mich;Eher typisch für mich;Ziemlich untypisch für mich;Ziemlich typisch für mich;Ziemlich typisch für mich;Eher typisch für mich;Eher untypisch für mich;Ziemlich untypisch für mich;Ziemlich typisch für mich;Sehr typisch für mich;2;ausgewählt;ausgewählt;nicht gewählt;nicht gewählt;2;nicht gewählt;ausgewählt;ausgewählt;nicht gewählt;2;ausgewählt;ausgewählt;nicht gewählt;nicht gewählt;2;nicht gewählt;nicht gewählt;ausgewählt;ausgewählt;2;nicht gewählt;ausgewählt;ausgewählt;nicht gewählt;2;nicht gewählt;ausgewählt;ausgewählt;nicht gewählt;2;ausgewählt;ausgewählt;nicht gewählt;nicht gewählt;2;nicht gewählt;nicht gewählt;ausgewählt;ausgewählt;2;nicht gewählt;ausgewählt;ausgewählt;nicht gewählt;2;nicht gewählt;ausgewählt;ausgewählt;nicht gewählt;2;nicht gewählt;ausgewählt;ausgewählt;nicht gewählt;2;nicht gewählt;ausgewählt;nicht gewählt;ausgewählt;2;ausgewählt;nicht gewählt;nicht gewählt;ausgewählt;2;ausgewählt;nicht gewählt;ausgewählt;nicht gewählt;3;ausgewählt;ausgewählt;ausgewählt;nicht gewählt;3;ausgewählt;ausgewählt;nicht gewählt;ausgewählt;VARK;8;9;7;10;;;;;;;1594;808.39;785.79;
base;männlich;32;;Azerbaijan;Bachelor Abschluss;;Studierende/r;Rechts;ID10;LEARN-012;A;Kundenstammsatz verwalten;Kundenstammsatz verwalten;Lieferantenstammsatz verwalten;Lieferantenstammsatz verwalten;3;1;ausgewählt;ausgewählt;nicht gewählt;nicht gewählt;ausgewählt;nicht gewählt;ausgewählt;nicht gewählt;nicht gewählt;nicht gewählt;nicht gewählt;nicht gewählt;3;1;nicht gewählt;nicht gewählt;nicht gewählt;nicht gewählt;ausgewählt;nicht gewählt;ausgewählt;nicht gewählt;nicht gewählt;nicht gewählt;ausgewählt;ausgewählt;Vertriebsbereich;Vertriebsbereich;Lieferantenabstimmkonto;Lieferantenabstimmkonto;Kundenabstimmkonto;Kundenabstimmkonto;Übernehmen;Anlegen;Oben links unter dem Namen des Kunden/Lieferanten;Oben links unter dem Namen des Kunden/Lieferanten;Jeweilige Schaltfläche Buchungskreise, Rollen, Adressdetails;Jeweilige Schaltfläche Buchungskreise, Rollen, Adressdetails;"Schaltfläche ""GP-Rolle""";Pfeil am Ende der Zeile;4;Ich stimme zu;4;4;Ich stimme zu;Ich stimme zu;4;2;3;Ich stimme nicht zu;Ich stimme zu;Ich stimme zu;Ich stimme zu;Ich stimme zu;4;Ich stimme zu;4;3;ausgewählt;ausgewählt;ausgewählt;ausgewählt;nicht gewählt;nicht gewählt;ausgewählt;nicht gewählt;ausgewählt;nicht gewählt;nicht gewählt;ausgewählt;Ja;Nein;Ja;;udemy;;Ja;Ja;Da man viel Zeit und Geld sparen und eigene Lerngeschwindigkeit nehmen kann;Da es zu einer Verbesserung der Fehler kommen wird;;;E-Learning;E-Learning;;;Da Lernende unterschiedliche Denkgeschwindigkeit haben;;Nein;Ja;Ziemlich typisch für mich;Ziemlich typisch für mich;Eher typisch für mich;Ziemlich typisch für mich;Ziemlich typisch für mich;Eher typisch für mich;Eher typisch für mich;Sehr typisch für mich;Eher typisch für mich;Eher typisch für mich;Eher typisch für mich;Eher untypisch für mich;Eher untypisch für mich;Ziemlich typisch für mich;Eher typisch für mich;Eher typisch für mich;Ziemlich typisch für mich;Sehr typisch für mich;Eher untypisch für mich;Eher untypisch für mich;Ziemlich untypisch für mich;Eher typisch für mich;Eher typisch für mich;Eher typisch für mich;Sehr typisch für mich;Eher typisch für mich;Eher untypisch für mich;Ziemlich typisch für mich;Sehr typisch für mich;Eher typisch für mich;2;nicht gewählt;ausgewählt;ausgewählt;nicht gewählt;3;ausgewählt;ausgewählt;ausgewählt;nicht gewählt;1;ausgewählt;nicht gewählt;nicht gewählt;nicht gewählt;1;nicht gewählt;nicht gewählt;ausgewählt;nicht gewählt;1;nicht gewählt;nicht gewählt;ausgewählt;nicht gewählt;2;ausgewählt;ausgewählt;nicht gewählt;nicht gewählt;2;ausgewählt;ausgewählt;nicht gewählt;nicht gewählt;2;nicht gewählt;nicht gewählt;ausgewählt;ausgewählt;2;nicht gewählt;ausgewählt;ausgewählt;nicht gewählt;1;nicht gewählt;nicht gewählt;ausgewählt;nicht gewählt;3;ausgewählt;ausgewählt;nicht gewählt;ausgewählt;1;nicht gewählt;nicht gewählt;nicht gewählt;ausgewählt;2;nicht gewählt;ausgewählt;ausgewählt;nicht gewählt;2;nicht gewählt;ausgewählt;ausgewählt;nicht gewählt;3;ausgewählt;ausgewählt;ausgewählt;nicht gewählt;1;nicht gewählt;nicht gewählt;nicht gewählt;ausgewählt;ARK;4;8;8;9;PDF;PDF;Man kann alles schritt für Schritt übersichtlicher nachschauen;"Mehr farben und einfach aufzählen bsp: 1. ""Konto anlegen"" 2. ...";Ton;Visuell ansprechend, wichtige sachen müssen dick geschrieben sein und nicht unnötig viel text, sondern wirklich nur die stichpunkte;2247;1512.32;734.69;
base;männlich;30;;Germany;Master Abschluss;;Angestellte/r;Rechts;ID11;LEARN-014;B;Kunde anlegen;Geschäftspartnerstammdaten verwalten;Lieferant anlegen;Geschäftspartnerstammdaten verwalten;3;1;ausgewählt;nicht gewählt;ausgewählt;ausgewählt;nicht gewählt;nicht gewählt;nicht gewählt;nicht gewählt;ausgewählt;nicht gewählt;nicht gewählt;nicht gewählt;4;1;ausgewählt;nicht gewählt;ausgewählt;nicht gewählt;nicht gewählt;nicht gewählt;nicht gewählt;nicht gewählt;ausgewählt;ausgewählt;ausgewählt;nicht gewählt;Vertriebsbereich;Vertriebswegsbereich;Lieferantenabstimmkonto;Lieferantenabstimmkonto;Kundenabstimmkonto;Bankkonto;Übernehmen;Anwenden;Unten Rechts;Oben links neben dem Namen des Kunden/Lieferanten;Anlegen;Anlegen;Pfeil am Ende der Zeile;"Schaltfläche ""Buchungskreisspezifische Daten""";Ich stimme zu;4;2;Ich stimme nicht zu;Ich stimme zu;Ich stimme zu;Ich stimme zu;3;Ich stimme nicht zu;2;Ich stimme zu;Ich stimme zu;Ich stimme zu;Ich stimme zu;Ich stimme zu;4;5;5;ausgewählt;ausgewählt;ausgewählt;ausgewählt;nicht gewählt;nicht gewählt;ausgewählt;ausgewählt;ausgewählt;ausgewählt;ausgewählt;ausgewählt;Ja;Ja;Ja;;SAP, Microsoft;;Ja;Ja;Verbesserung der Nutzungseffizienz;Um den Umgang mit dem System zu Schulen;;;E-Learning;E-Learning;;;Individuelle Nutzung;Da Menschen, die sehr schüchtern sind sich nicht der unangenehmen Konsequenz des nachfragens stellen Müssen, da man alles nachlesen kann;Ja;Ja;Ziemlich typisch für mich;Sehr typisch für mich;Ziemlich typisch für mich;Sehr typisch für mich;Eher untypisch für mich;Eher typisch für mich;Sehr typisch für mich;Ziemlich typisch für mich;Ziemlich typisch für mich;Eher typisch für mich;Ziemlich typisch für mich;Ziemlich untypisch für mich;Sehr typisch für mich;Sehr typisch für mich;Eher typisch für mich;Sehr typisch für mich;Eher untypisch für mich;Ziemlich typisch für mich;Sehr typisch für mich;Eher typisch für mich;Ziemlich typisch für mich;Sehr typisch für mich;Ziemlich typisch für mich;Ziemlich typisch für mich;Ziemlich typisch für mich;Eher untypisch für mich;Ziemlich untypisch für mich;Ziemlich typisch für mich;Ziemlich typisch für mich;Sehr untypisch für mich;2;nicht gewählt;ausgewählt;nicht gewählt;ausgewählt;2;ausgewählt;ausgewählt;nicht gewählt;nicht gewählt;1;ausgewählt;nicht gewählt;nicht gewählt;nicht gewählt;3;nicht gewählt;ausgewählt;ausgewählt;ausgewählt;3;ausgewählt;ausgewählt;nicht gewählt;ausgewählt;2;nicht gewählt;ausgewählt;nicht gewählt;ausgewählt;1;ausgewählt;nicht gewählt;nicht gewählt;nicht gewählt;2;nicht gewählt;nicht gewählt;ausgewählt;ausgewählt;2;nicht gewählt;ausgewählt;ausgewählt;nicht gewählt;2;ausgewählt;nicht gewählt;nicht gewählt;ausgewählt;2;ausgewählt;nicht gewählt;ausgewählt;nicht gewählt;2;ausgewählt;ausgewählt;nicht gewählt;nicht gewählt;3;ausgewählt;ausgewählt;nicht gewählt;ausgewählt;1;nicht gewählt;nicht gewählt;ausgewählt;nicht gewählt;3;nicht gewählt;ausgewählt;ausgewählt;ausgewählt;2;ausgewählt;ausgewählt;nicht gewählt;nicht gewählt;Auditiv;9;14;5;5;Video;PDF;Scrollen im Dokument parallel zum Klicken. Möglichkeit Schritte zu überspringen.;-;Sprungmarken einfügen, Lange Suchpasen im Video vermeiden;Häufigere Wiederholungen;1439;666.496;772.48;Aufgabe 1 nicht aufgezeichnet
base;weiblich;33;;Germany;Fachabitur;;Angestellte/r;Rechts;ID12;LEARN-015;A;Kunde anlegen;;Lieferant anlegen;;2;;ausgewählt;;ausgewählt;;nicht gewählt;;nicht gewählt;;nicht gewählt;;nicht gewählt;;2;;nicht gewählt;;nicht gewählt;;nicht gewählt;;nicht gewählt;;ausgewählt;;ausgewählt;;Vertriebswegsbereich;;Lieferantenabstimmkonto;;Kundenabstimmkonto;;Übernehmen;;Oben rechts;;Jeweilige Schaltfläche Buchungskreise, Rollen, Adressdetails;;"Schaltfläche ""Buchungskreisspezifische Daten""";;4;;2;;3;;4;;2;;4;;4;;3;;5;;nicht gewählt;;ausgewählt;;ausgewählt;;ausgewählt;;ausgewählt;;ausgewählt;;Nein;;Nein;;;;Ja;;Hilfreich;;;;E-Learning;;;;Flexibel;Flexibleres Training und gezielt vor der Systemnutzung;Ja;;Eher typisch für mich;Sehr typisch für mich;Eher typisch für mich;Eher untypisch für mich;Eher typisch für mich;Eher untypisch für mich;Ziemlich typisch für mich;Eher typisch für mich;Sehr typisch für mich;Eher untypisch für mich;Eher untypisch für mich;Ziemlich typisch für mich;Sehr untypisch für mich;Eher untypisch für mich;Eher untypisch für mich;Ziemlich typisch für mich;Ziemlich typisch für mich;Eher untypisch für mich;Eher untypisch für mich;Eher untypisch für mich;Eher typisch für mich;Eher untypisch für mich;Ziemlich untypisch für mich;Eher untypisch für mich;Eher untypisch für mich;Ziemlich untypisch für mich;Eher untypisch für mich;Eher untypisch für mich;Eher typisch für mich;Sehr untypisch für mich;1;nicht gewählt;nicht gewählt;nicht gewählt;ausgewählt;1;nicht gewählt;nicht gewählt;ausgewählt;nicht gewählt;1;ausgewählt;nicht gewählt;nicht gewählt;nicht gewählt;1;nicht gewählt;nicht gewählt;ausgewählt;nicht gewählt;2;ausgewählt;ausgewählt;nicht gewählt;nicht gewählt;2;ausgewählt;ausgewählt;nicht gewählt;nicht gewählt;2;ausgewählt;ausgewählt;nicht gewählt;nicht gewählt;2;nicht gewählt;nicht gewählt;ausgewählt;ausgewählt;2;nicht gewählt;ausgewählt;ausgewählt;nicht gewählt;1;ausgewählt;nicht gewählt;nicht gewählt;nicht gewählt;1;nicht gewählt;nicht gewählt;ausgewählt;nicht gewählt;2;nicht gewählt;nicht gewählt;ausgewählt;ausgewählt;2;ausgewählt;nicht gewählt;ausgewählt;nicht gewählt;1;nicht gewählt;nicht gewählt;ausgewählt;nicht gewählt;1;nicht gewählt;nicht gewählt;ausgewählt;nicht gewählt;3;nicht gewählt;ausgewählt;ausgewählt;ausgewählt;VARK;5;7;5;8;;;;;;;1943;926.21;1017.22;
base;weiblich;32;;Germany;Master Abschluss;;Angestellte/r;Rechts;ID13;LEARN-017;B;Kunde anlegen;Kunde anlegen;Lieferant anlegen;Kreditor anlegen;2;2;nicht gewählt;nicht gewählt;nicht gewählt;ausgewählt;ausgewählt;ausgewählt;nicht gewählt;nicht gewählt;ausgewählt;nicht gewählt;nicht gewählt;nicht gewählt;2;1;nicht gewählt;nicht gewählt;ausgewählt;nicht gewählt;nicht gewählt;nicht gewählt;ausgewählt;nicht gewählt;nicht gewählt;ausgewählt;nicht gewählt;nicht gewählt;Vertriebsbereich;Vertriebsbereich;Lieferantenabstimmkonto;Forderungen aus Lieferungen und Leistungen;Kundenabstimmkonto;Verbindlichkeiten aus Lieferungen und Leistungen;Anwenden;Anwenden;Unten Links;Oben links neben dem Namen des Kunden/Lieferanten;Anlegen;Anlegen;"Schaltfläche ""GP-Rolle""";Pfeil am Ende der Zeile;4;4;3;3;Ich stimme zu;4;3;3;2;3;Ich stimme zu;Ich stimme zu;3;2;Ich stimme zu;4;6;6;ausgewählt;ausgewählt;ausgewählt;ausgewählt;ausgewählt;ausgewählt;ausgewählt;ausgewählt;ausgewählt;ausgewählt;ausgewählt;ausgewählt;Ja;Ja;Ja;;SAP TERP10;;Ja;Ja;damit man direkt effizent im System arbeiten kann (ansonsten muss man sich erst selbst Einarbeiten, was länger dauert und Fehler generiert);für eine effizientere Nutzung der Systeme, da ansonsten Funktion z.B. unklar bleiben;;;Präsenztraining;E-Learning;direkte Fragen möglich;;;;Ja;Ja;Ziemlich typisch für mich;Ziemlich typisch für mich;Ziemlich untypisch für mich;Eher untypisch für mich;Eher typisch für mich;Sehr typisch für mich;Ziemlich typisch für mich;Ziemlich typisch für mich;Ziemlich typisch für mich;Eher untypisch für mich;Eher untypisch für mich;Ziemlich untypisch für mich;Eher typisch für mich;Eher typisch für mich;Eher untypisch für mich;Sehr typisch für mich;Ziemlich typisch für mich;Eher typisch für mich;Ziemlich untypisch für mich;Eher typisch für mich;Ziemlich untypisch für mich;Sehr typisch für mich;Sehr typisch für mich;Ziemlich typisch für mich;Eher typisch für mich;Ziemlich typisch für mich;Ziemlich typisch für mich;Eher untypisch für mich;Ziemlich typisch für mich;Ziemlich untypisch für mich;1;nicht gewählt;ausgewählt;nicht gewählt;nicht gewählt;2;ausgewählt;nicht gewählt;ausgewählt;nicht gewählt;2;nicht gewählt;ausgewählt;ausgewählt;nicht gewählt;1;nicht gewählt;nicht gewählt;ausgewählt;nicht gewählt;1;nicht gewählt;ausgewählt;nicht gewählt;nicht gewählt;2;nicht gewählt;ausgewählt;ausgewählt;nicht gewählt;2;ausgewählt;ausgewählt;nicht gewählt;nicht gewählt;1;nicht gewählt;ausgewählt;nicht gewählt;nicht gewählt;1;nicht gewählt;nicht gewählt;ausgewählt;nicht gewählt;2;nicht gewählt;ausgewählt;ausgewählt;nicht gewählt;2;ausgewählt;nicht gewählt;ausgewählt;nicht gewählt;2;nicht gewählt;nicht gewählt;ausgewählt;ausgewählt;1;ausgewählt;nicht gewählt;nicht gewählt;nicht gewählt;1;nicht gewählt;nicht gewählt;ausgewählt;nicht gewählt;2;nicht gewählt;ausgewählt;nicht gewählt;ausgewählt;3;ausgewählt;nicht gewählt;ausgewählt;ausgewählt;Visuell;10;6;5;5;Video;Video;Es war einfacher die Schaltflächen zu finden.;Mehr Erklärungen, warum ich was mache und wozu es gut ist.;(1) Mehr Erklärungen, warum ich was mache und wozu es gut ist. (2) Tonspur hinzufügen. (3) Lesezeichen in den Videos setzen, um an bestimmte Stellen springen zu können.;gut strukturiert, modular, unterschiedliche Medien, evtl. eine Art Gamification für die Motivation, Erklärungen zu den Schritten, immer wieder aufrufbar;1427;696.83;730.11;
