base;weiblich;27;;Germany;Bachelor Abschluss;;Angestellte/r;Rechts;ID22;LEARN-026;A;Kundenstammsatz verwalten;;Geschäftspartnerstammdaten verwalten;;2;;ausgewählt;;ausgewählt;;nicht gewählt;;nicht gewählt;;nicht gewählt;;nicht gewählt;;1;;nicht gewählt;;nicht gewählt;;nicht gewählt;;nicht gewählt;;nicht gewählt;;ausgewählt;;Vertriebsbereich;;Verbindlichkeiten aus Lieferungen und Leistungen;;Kundenabstimmkonto;;Anlegen;;Oben links unter dem Namen des Kunden/Lieferanten;;Anlegen;;"Schaltfläche ""GP-Rolle""";;4;;4;;4;;2;;3;;Ich stimme zu;;Ich stimme zu;;Ich stimme zu;;5;;ausgewählt;;ausgewählt;;ausgewählt;;ausgewählt;;nicht gewählt;;ausgewählt;;Nein;;Nein;;;;Ja;;Effizienz ;;;;E-Learning;;;;Flexibel ;felxibler, Pausen können individuell eingelegt werden, von überall anzuwenden (nicht ortbezogen);Nein;;Eher untypisch für mich;Ziemlich typisch für mich;Eher untypisch für mich;Eher typisch für mich;Ziemlich untypisch für mich;Eher untypisch für mich;Ziemlich typisch für mich;Eher typisch für mich;Ziemlich typisch für mich;Ziemlich untypisch für mich;Sehr untypisch für mich;Ziemlich typisch für mich;Sehr untypisch für mich;Ziemlich typisch für mich;Sehr untypisch für mich;Sehr typisch für mich;Ziemlich typisch für mich;Eher typisch für mich;Ziemlich untypisch für mich;Eher untypisch für mich;Ziemlich typisch für mich;Eher typisch für mich;Eher untypisch für mich;Eher typisch für mich;Eher typisch für mich;Ziemlich untypisch für mich;Eher typisch für mich;Ziemlich untypisch für mich;Ziemlich typisch für mich;Sehr untypisch für mich;1;nicht gewählt;ausgewählt;nicht gewählt;nicht gewählt;2;ausgewählt;ausgewählt;nicht gewählt;nicht gewählt;2;ausgewählt;nicht gewählt;ausgewählt;nicht gewählt;1;nicht gewählt;nicht gewählt;ausgewählt;nicht gewählt;2;ausgewählt;ausgewählt;nicht gewählt;nicht gewählt;1;nicht gewählt;ausgewählt;nicht gewählt;nicht gewählt;1;nicht gewählt;nicht gewählt;ausgewählt;nicht gewählt;2;nicht gewählt;ausgewählt;nicht gewählt;ausgewählt;1;nicht gewählt;ausgewählt;nicht gewählt;nicht gewählt;2;nicht gewählt;ausgewählt;nicht gewählt;ausgewählt;1;nicht gewählt;nicht gewählt;ausgewählt;nicht gewählt;1;nicht gewählt;nicht gewählt;ausgewählt;nicht gewählt;2;ausgewählt;nicht gewählt;nicht gewählt;ausgewählt;1;ausgewählt;nicht gewählt;nicht gewählt;nicht gewählt;2;ausgewählt;nicht gewählt;ausgewählt;nicht gewählt;1;nicht gewählt;nicht gewählt;nicht gewählt;ausgewählt;VAK;7;6;3;6;;;;;;;2236;956.67;1279.55;
base;männlich;25;;Germany;Master Abschluss;;Angestellte/r;Rechts;ID23;LEARN-027;B;Debitor anlegen;Kunde anlegen;Kreditor anlegen;Lieferant anlegen;2;1;ausgewählt;ausgewählt;nicht gewählt;nicht gewählt;nicht gewählt;nicht gewählt;nicht gewählt;nicht gewählt;nicht gewählt;nicht gewählt;nicht gewählt;nicht gewählt;2;1;nicht gewählt;nicht gewählt;ausgewählt;nicht gewählt;nicht gewählt;nicht gewählt;nicht gewählt;nicht gewählt;nicht gewählt;nicht gewählt;ausgewählt;ausgewählt;Buchungskreisbereich;Vertriebsbereich;Forderungen aus Lieferungen und Leistungen;Forderungen aus Lieferungen und Leistungen;Verbindlichkeiten aus Lieferungen und Leistungen;Verbindlichkeiten aus Lieferungen und Leistungen;Anlegen;Anlegen;Im Dropdownfeld;Oben rechts;Anlegen;Neu;"Schaltfläche ""GP-Rolle""";"Schaltfläche ""GP-Rolle""";Ich stimme zu;Ich stimme zu;3;4;4;Ich stimme zu;3;2;Ich stimme nicht zu;Ich stimme nicht zu;Ich stimme zu;Ich stimme zu;Ich stimme zu;Ich stimme zu;Ich stimme zu;Ich stimme zu;4;3;ausgewählt;ausgewählt;ausgewählt;ausgewählt;nicht gewählt;nicht gewählt;ausgewählt;nicht gewählt;ausgewählt;ausgewählt;nicht gewählt;nicht gewählt;Nein;Ja;Ja;;TS410, SAP CRM, SAP ABAP;;Ja;Ja;Einblicke in arbeitsrelevante Themen und Programme.;Endanwenderschulungen sind elementar, um notwendiges Wissen und Fähigkeiten zum Umgang mit IT-Systemen aufzubauen;;;E-Learning;E-Learning;;;Flexible Einteilung des Lernens, Interaktivere Möglichkeiten als Frontalunterricht (z.B. Moodle-Quizzes zur Überprüfung des Lernstands);;Ja;Ja;Ziemlich typisch für mich;Eher untypisch für mich;Ziemlich untypisch für mich;Eher typisch für mich;Eher typisch für mich;Ziemlich untypisch für mich;Ziemlich untypisch für mich;Ziemlich typisch für mich;Ziemlich typisch für mich;Sehr untypisch für mich;Eher untypisch für mich;Sehr untypisch für mich;Sehr typisch für mich;Sehr typisch für mich;Eher typisch für mich;Ziemlich typisch für mich;Eher untypisch für mich;Ziemlich typisch für mich;Ziemlich untypisch für mich;Ziemlich untypisch für mich;Sehr untypisch für mich;Eher untypisch für mich;Ziemlich untypisch für mich;Eher untypisch für mich;Eher typisch für mich;Ziemlich typisch für mich;Ziemlich untypisch für mich;Eher typisch für mich;Eher typisch für mich;Sehr untypisch für mich;1;nicht gewählt;ausgewählt;nicht gewählt;nicht gewählt;2;ausgewählt;ausgewählt;nicht gewählt;nicht gewählt;2;nicht gewählt;ausgewählt;nicht gewählt;ausgewählt;2;nicht gewählt;nicht gewählt;ausgewählt;ausgewählt;1;ausgewählt;nicht gewählt;nicht gewählt;nicht gewählt;2;ausgewählt;ausgewählt;nicht gewählt;nicht gewählt;2;ausgewählt;nicht gewählt;ausgewählt;nicht gewählt;2;nicht gewählt;nicht gewählt;ausgewählt;ausgewählt;1;nicht gewählt;nicht gewählt;ausgewählt;nicht gewählt;2;nicht gewählt;ausgewählt;ausgewählt;nicht gewählt;2;ausgewählt;nicht gewählt;ausgewählt;nicht gewählt;2;nicht gewählt;ausgewählt;ausgewählt;nicht gewählt;2;nicht gewählt;nicht gewählt;ausgewählt;ausgewählt;2;ausgewählt;nicht gewählt;ausgewählt;nicht gewählt;2;nicht gewählt;nicht gewählt;ausgewählt;ausgewählt;3;ausgewählt;ausgewählt;ausgewählt;nicht gewählt;Visuell;11;7;7;4;Video;Video;Möglichkeit zu pausieren und sich dann selbst mit dem System auseinanderzusetzen, Möglichkeiten zur visuellen Verbesserung;Mehr Abbildungen zum besseren Verständnis, Eventuell QR-Codes zu Erklärvideos oder Audiofiles;Besseres Highlighten der Klicks und Kernkomponenten;Virtuell und interaktiv mit Videos/Audiodateien. Eventuell Lernstandskontrollen mittels MC-Tests und/oder interaktiven Quizzes.;1472;762.18;710.14;
base;männlich;27;;Germany;Master Abschluss;;Angestellte/r;Rechts;ID24;LEARN-032;A;Geschäftspartnerstammdaten verwalten;Geschäftspartnerstammdaten verwalten;Geschäftspartnerstammdaten verwalten;Geschäftspartnerstammdaten verwalten;4;4;ausgewählt;ausgewählt;ausgewählt;ausgewählt;nicht gewählt;nicht gewählt;nicht gewählt;nicht gewählt;ausgewählt;ausgewählt;ausgewählt;ausgewählt;3;4;nicht gewählt;ausgewählt;ausgewählt;ausgewählt;nicht gewählt;nicht gewählt;nicht gewählt;nicht gewählt;ausgewählt;ausgewählt;ausgewählt;ausgewählt;Vertriebsbereich;Einkaufsbereich;Verbindlichkeiten aus Lieferungen und Leistungen;Lieferantenabstimmkonto;Verbindlichkeiten aus Lieferungen und Leistungen;Kundenabstimmkonto;Anwenden;Anwenden;Oben links unter dem Namen des Kunden/Lieferanten;Oben links neben dem Namen des Kunden/Lieferanten;Jeweilige Schaltfläche Buchungskreise, Rollen, Adressdetails;Anlegen;Pfeil am Ende der Zeile;Pfeil am Ende der Zeile;Ich stimme zu;4;3;3;Ich stimme zu;4;3;4;2;2;Ich stimme zu;Ich stimme zu;Ich stimme zu;3;Ich stimme zu;Ich stimme zu;5;2;ausgewählt;nicht gewählt;ausgewählt;ausgewählt;ausgewählt;nicht gewählt;nicht gewählt;nicht gewählt;ausgewählt;nicht gewählt;ausgewählt;ausgewählt;Ja;Ja;Nein;;;;Ja;Ja;Man erhält erste praktische Einblicke in das System und kann dinge ausprobieren und auch falsch machen, ohne das System nachhaltig zu schädigen.;Um die Systeme besser zu verstehen;;;Präsenztraining;Präsenztraining;In Präsenz können aufkommende Fragen direkt vom Dozenten beantwortet werden. Es kann zu individuellen Problemen kommen, bei denen sofortige Hilfe nötig ist.;Der Dozent kann dann individueller auf die Fragen der Teilnehmenden eingehen;;Flexibleres Lernen, eigene Zeiteinteilung;Ja;Ja;Sehr typisch für mich;Ziemlich typisch für mich;Eher untypisch für mich;Eher untypisch für mich;Ziemlich typisch für mich;Sehr typisch für mich;Ziemlich untypisch für mich;Eher typisch für mich;Ziemlich typisch für mich;Sehr untypisch für mich;Sehr typisch für mich;Sehr typisch für mich;Ziemlich typisch für mich;Ziemlich typisch für mich;Ziemlich typisch für mich;Eher typisch für mich;Ziemlich typisch für mich;Eher untypisch für mich;Ziemlich typisch für mich;Sehr untypisch für mich;Ziemlich typisch für mich;Eher typisch für mich;Eher typisch für mich;Eher untypisch für mich;Sehr typisch für mich;Ziemlich typisch für mich;Ziemlich untypisch für mich;Eher typisch für mich;Eher typisch für mich;Sehr typisch für mich;1;nicht gewählt;ausgewählt;nicht gewählt;nicht gewählt;2;ausgewählt;ausgewählt;nicht gewählt;nicht gewählt;2;ausgewählt;nicht gewählt;ausgewählt;nicht gewählt;2;ausgewählt;nicht gewählt;nicht gewählt;ausgewählt;0;nicht gewählt;nicht gewählt;nicht gewählt;nicht gewählt;2;nicht gewählt;ausgewählt;ausgewählt;nicht gewählt;2;ausgewählt;ausgewählt;nicht gewählt;nicht gewählt;1;nicht gewählt;nicht gewählt;ausgewählt;nicht gewählt;2;nicht gewählt;ausgewählt;ausgewählt;nicht gewählt;3;ausgewählt;nicht gewählt;ausgewählt;ausgewählt;2;ausgewählt;nicht gewählt;ausgewählt;nicht gewählt;1;nicht gewählt;nicht gewählt;nicht gewählt;ausgewählt;2;ausgewählt;ausgewählt;nicht gewählt;nicht gewählt;1;ausgewählt;nicht gewählt;nicht gewählt;nicht gewählt;3;ausgewählt;ausgewählt;ausgewählt;nicht gewählt;3;ausgewählt;ausgewählt;nicht gewählt;ausgewählt;AK;5;10;4;10;PDF;Video;Peripherieeingaben konnten besser nachvollzogen werden;Mehr Bilder;Qualitätssicherung sollte durchgeführt werden. Außerdem wäre eine Vertonung sicherlich hilfreich.;Kurze, wiederholende Lerneinheiten mit unterschiedlichem Kontext;1284;564;720.13;
base;männlich;22;;Germany;Bachelor Abschluss;;Studierende/r;Rechts;ID25;LEARN-041;B;Kundenstammsatz verwalten;Kunde anlegen;Geschäftspartnerstammdaten verwalten;Lieferant anlegen;1;2;ausgewählt;ausgewählt;nicht gewählt;nicht gewählt;nicht gewählt;nicht gewählt;nicht gewählt;ausgewählt;nicht gewählt;nicht gewählt;nicht gewählt;nicht gewählt;2;3;nicht gewählt;ausgewählt;nicht gewählt;ausgewählt;nicht gewählt;ausgewählt;ausgewählt;nicht gewählt;nicht gewählt;nicht gewählt;ausgewählt;nicht gewählt;Vertriebsbereich;Vertriebsbereich;Verbindlichkeiten aus Lieferungen und Leistungen;Verbindlichkeiten aus Lieferungen und Leistungen;Kundenabstimmkonto;Bankkonto;Anwenden;Anlegen;Oben links neben dem Namen des Kunden/Lieferanten;Oben links neben dem Namen des Kunden/Lieferanten;Anlegen;Jeweilige Schaltfläche Buchungskreise, Rollen, Adressdetails;"Schaltfläche ""Buchungskreisspezifische Daten""";Pfeil am Ende der Zeile;Ich stimme zu;4;2;3;4;Ich stimme zu;2;3;2;Ich stimme nicht zu;Ich stimme zu;Ich stimme zu;2;Ich stimme zu;2;3;5;5;ausgewählt;ausgewählt;ausgewählt;ausgewählt;nicht gewählt;ausgewählt;ausgewählt;nicht gewählt;ausgewählt;ausgewählt;ausgewählt;ausgewählt;Ja;Ja;Nein;;;;Ja;Ja;, um die Nutzung zu Lernen und Erfahrung zu sammeln.;Weil es meisten standardisierte Verfahren sind, die sich jeder auch alleine, flexibel von zu Hause aus angucken kann.;;;E-Learning;E-Learning;;;, weil man eh sich am Prorgamm durchklickt;;Nein;Ja;Eher typisch für mich;Ziemlich typisch für mich;Eher typisch für mich;Ziemlich typisch für mich;Ziemlich typisch für mich;Eher typisch für mich;Ziemlich typisch für mich;Eher typisch für mich;Sehr typisch für mich;Eher untypisch für mich;Eher typisch für mich;Eher typisch für mich;Eher untypisch für mich;Eher typisch für mich;Ziemlich untypisch für mich;Eher untypisch für mich;Eher typisch für mich;Ziemlich untypisch für mich;Eher untypisch für mich;Eher untypisch für mich;Eher typisch für mich;Ziemlich untypisch für mich;Ziemlich untypisch für mich;Eher untypisch für mich;Eher untypisch für mich;Eher untypisch für mich;Eher typisch für mich;Eher untypisch für mich;Eher typisch für mich;Ziemlich untypisch für mich;2;nicht gewählt;ausgewählt;ausgewählt;nicht gewählt;2;ausgewählt;ausgewählt;nicht gewählt;nicht gewählt;4;ausgewählt;ausgewählt;ausgewählt;ausgewählt;2;ausgewählt;nicht gewählt;ausgewählt;nicht gewählt;1;ausgewählt;nicht gewählt;nicht gewählt;nicht gewählt;3;ausgewählt;ausgewählt;nicht gewählt;ausgewählt;4;ausgewählt;ausgewählt;ausgewählt;ausgewählt;3;nicht gewählt;ausgewählt;ausgewählt;ausgewählt;2;nicht gewählt;ausgewählt;ausgewählt;nicht gewählt;2;nicht gewählt;ausgewählt;ausgewählt;nicht gewählt;2;ausgewählt;nicht gewählt;ausgewählt;nicht gewählt;3;nicht gewählt;ausgewählt;ausgewählt;ausgewählt;2;ausgewählt;ausgewählt;nicht gewählt;nicht gewählt;2;ausgewählt;nicht gewählt;ausgewählt;nicht gewählt;3;ausgewählt;ausgewählt;nicht gewählt;ausgewählt;3;ausgewählt;ausgewählt;nicht gewählt;ausgewählt;VARK;10;13;6;11;Video;Beides;Beides hat Vorteile, beim Video kann ich genau schauen, wo ich was machen muss, bei der PDF kann ich einzelene Schrittfolgen schnell überspringen/erledeigen und muss nicht auf das video warten;Generell so viele Bilder wie möglich und Sachen gut hervorheben;Text im Video hervorheben, vllt sogar Text-to-speech;Eine Mischung aus E-Learning und Vorort Training. Bei Standard Verfahren E-Learning und bei komplexeren Sachverhalten Vorort mit einem Trainer;1282;647.17;634.98;
base;weiblich;50;;Germany;Anderer Abschluss;Konditormeister, Betriebswirt des Handwerks;Selbstständig;Rechts;ID26;LEARN-042;A;Kundenstammsatz verwalten;Kundenstammsatz verwalten;Lieferantenstammsatz verwalten;Lieferantenstammsatz verwalten;1;2;nicht gewählt;ausgewählt;ausgewählt;ausgewählt;nicht gewählt;nicht gewählt;nicht gewählt;nicht gewählt;nicht gewählt;nicht gewählt;nicht gewählt;nicht gewählt;1;2;nicht gewählt;nicht gewählt;nicht gewählt;nicht gewählt;nicht gewählt;nicht gewählt;nicht gewählt;nicht gewählt;ausgewählt;ausgewählt;nicht gewählt;ausgewählt;Kundenbereich;Kundenbereich;Verbindlichkeiten aus Lieferungen und Leistungen;Verbindlichkeiten aus Lieferungen und Leistungen;Forderungen aus Lieferungen und Leistungen;Forderungen aus Lieferungen und Leistungen;Übernehmen;Anwenden;Oben links unter dem Namen des Kunden/Lieferanten;Oben links unter dem Namen des Kunden/Lieferanten;Hinzufügen;Jeweilige Schaltfläche Buchungskreise, Rollen, Adressdetails;Pfeil am Ende der Zeile;"Schaltfläche ""GP-Rolle""";3;3;3;Ich stimme nicht zu;Ich stimme zu;Ich stimme zu;3;Ich stimme zu;3;3;Ich stimme zu;Ich stimme zu;Ich stimme zu;Ich stimme zu;3;Ich stimme nicht zu;4;3;nicht gewählt;nicht gewählt;ausgewählt;ausgewählt;ausgewählt;ausgewählt;ausgewählt;ausgewählt;nicht gewählt;nicht gewählt;ausgewählt;nicht gewählt;Nein;Ja;Nein;;;;Ja;Ja;Wenig Kommunikationsverluste;Um ein Programm in seiner Komplexität voll ausschöpfen zu können. ;;;E-Learning;Präsenztraining;;Ich denke, dass unterschiedliche Personen unterschiedliche Vorgehensweisen beim Lernen haben, daher glaube ich nicht, dass es hier ein Ja oder Nein als Antwort gibt. Der Vorteil vom E-Learning ist defititiv die Möglichkeit der individuellen Nacharbeitung. ;Die Möglichkeit der Wiederholung und Vertiefung ist individuell eher möglich;Vor allem E-learning, aber eine Mischung könnte sinnvoll sein;Nein;Nein;Sehr typisch für mich;Eher typisch für mich;Sehr typisch für mich;Sehr typisch für mich;Eher typisch für mich;Sehr typisch für mich;Eher typisch für mich;Sehr typisch für mich;Sehr typisch für mich;Sehr typisch für mich;Sehr typisch für mich;Eher untypisch für mich;Sehr typisch für mich;Sehr typisch für mich;Sehr typisch für mich;Sehr typisch für mich;Eher untypisch für mich;Ziemlich typisch für mich;Sehr typisch für mich;Sehr untypisch für mich;Sehr untypisch für mich;Sehr typisch für mich;Eher untypisch für mich;Eher typisch für mich;Ziemlich typisch für mich;Ziemlich typisch für mich;Eher untypisch für mich;Sehr typisch für mich;Sehr typisch für mich;Ziemlich untypisch für mich;1;nicht gewählt;ausgewählt;nicht gewählt;nicht gewählt;2;nicht gewählt;ausgewählt;nicht gewählt;ausgewählt;1;nicht gewählt;nicht gewählt;nicht gewählt;ausgewählt;1;nicht gewählt;nicht gewählt;ausgewählt;nicht gewählt;2;ausgewählt;nicht gewählt;ausgewählt;nicht gewählt;1;nicht gewählt;nicht gewählt;nicht gewählt;ausgewählt;1;ausgewählt;nicht gewählt;nicht gewählt;nicht gewählt;1;nicht gewählt;ausgewählt;nicht gewählt;nicht gewählt;1;nicht gewählt;nicht gewählt;ausgewählt;nicht gewählt;2;ausgewählt;nicht gewählt;nicht gewählt;ausgewählt;1;nicht gewählt;nicht gewählt;ausgewählt;nicht gewählt;2;nicht gewählt;ausgewählt;nicht gewählt;ausgewählt;1;ausgewählt;nicht gewählt;nicht gewählt;nicht gewählt;1;nicht gewählt;nicht gewählt;ausgewählt;nicht gewählt;2;nicht gewählt;ausgewählt;ausgewählt;nicht gewählt;2;nicht gewählt;ausgewählt;nicht gewählt;ausgewählt;AK;1;10;2;9;PDF;Video;Da ich eine ausgeprägte Auditive Wahrnehmung habe. ;k.A.;k.A.;Optimal wäre, wenn für verschiednen Lerntypen, verschiedene Möglichkeiten geschaffen werden. ;3095;1363.71;1730.82;
base;männlich;25;;Germany;Fachabitur;;Angestellte/r;Rechts;ID27;LEARN-043;B;Kundenstammsatz verwalten;;Lieferantenstammsatz verwalten;;1;;nicht gewählt;;nicht gewählt;;nicht gewählt;;ausgewählt;;nicht gewählt;;nicht gewählt;;1;;nicht gewählt;;nicht gewählt;;nicht gewählt;;nicht gewählt;;nicht gewählt;;ausgewählt;;Vertriebsbereich;;Lieferantenabstimmkonto;;Kundenabstimmkonto;;Übernehmen;;Oben links unter dem Namen des Kunden/Lieferanten;;Neu;;"Schaltfläche ""Buchungskreisspezifische Daten""";;Ich stimme nicht zu;;Ich stimme nicht zu;;3;;Ich stimme zu;;Ich stimme zu;;Ich stimme zu;;Ich stimme zu;;2;;4;;ausgewählt;;nicht gewählt;;nicht gewählt;;ausgewählt;;ausgewählt;;ausgewählt;;Ja;;Nein;;;;Ja;;das wissen wird nochmal vertieft;;;;Präsenztraining;;man passt besser auf;;;;Nein;;Eher typisch für mich;Eher typisch für mich;Ziemlich typisch für mich;Ziemlich typisch für mich;Sehr typisch für mich;Sehr typisch für mich;Sehr typisch für mich;Ziemlich typisch für mich;Sehr typisch für mich;Eher untypisch für mich;Eher untypisch für mich;Sehr untypisch für mich;Sehr typisch für mich;Ziemlich typisch für mich;Eher untypisch für mich;Sehr typisch für mich;Sehr typisch für mich;Eher typisch für mich;Sehr untypisch für mich;Sehr typisch für mich;Eher typisch für mich;Sehr typisch für mich;Eher untypisch für mich;Ziemlich typisch für mich;Ziemlich typisch für mich;Sehr typisch für mich;Ziemlich typisch für mich;Eher untypisch für mich;Sehr typisch für mich;Ziemlich untypisch für mich;1;ausgewählt;nicht gewählt;nicht gewählt;nicht gewählt;1;ausgewählt;nicht gewählt;nicht gewählt;nicht gewählt;1;nicht gewählt;nicht gewählt;ausgewählt;nicht gewählt;1;ausgewählt;nicht gewählt;nicht gewählt;nicht gewählt;1;ausgewählt;nicht gewählt;nicht gewählt;nicht gewählt;1;ausgewählt;nicht gewählt;nicht gewählt;nicht gewählt;1;nicht gewählt;ausgewählt;nicht gewählt;nicht gewählt;2;nicht gewählt;nicht gewählt;ausgewählt;ausgewählt;2;nicht gewählt;ausgewählt;ausgewählt;nicht gewählt;2;nicht gewählt;ausgewählt;ausgewählt;nicht gewählt;1;nicht gewählt;nicht gewählt;ausgewählt;nicht gewählt;3;nicht gewählt;ausgewählt;ausgewählt;ausgewählt;3;ausgewählt;nicht gewählt;ausgewählt;ausgewählt;1;ausgewählt;nicht gewählt;nicht gewählt;nicht gewählt;2;ausgewählt;nicht gewählt;ausgewählt;nicht gewählt;3;ausgewählt;ausgewählt;nicht gewählt;ausgewählt;kinästhethisches Lernen;6;6;4;9;;;;;;;1850;905.86;944.13;
base;männlich;25;;Germany;Abitur;;Studierende/r;Rechts;ID28;LEARN-044;A;Kundenstammsatz verwalten;Kundenstammsatz verwalten;Lieferantenstammsatz verwalten;Lieferantenstammsatz verwalten;3;3;ausgewählt;ausgewählt;nicht gewählt;ausgewählt;nicht gewählt;nicht gewählt;nicht gewählt;nicht gewählt;ausgewählt;ausgewählt;ausgewählt;nicht gewählt;2;2;nicht gewählt;nicht gewählt;ausgewählt;ausgewählt;nicht gewählt;nicht gewählt;ausgewählt;ausgewählt;nicht gewählt;nicht gewählt;nicht gewählt;nicht gewählt;Einkaufsbereich;Einkaufsbereich;Forderungen aus Lieferungen und Leistungen;Forderungen aus Lieferungen und Leistungen;Forderungen aus Lieferungen und Leistungen;Verbindlichkeiten aus Lieferungen und Leistungen;Anlegen;Anwenden;Oben links unter dem Namen des Kunden/Lieferanten;In der Mitte;Anlegen;Neu;"Schaltfläche ""Buchungskreisspezifische Daten""";"Schaltfläche ""GP-Rolle""";Ich stimme zu;4;3;3;Ich stimme zu;Ich stimme zu;3;3;2;2;3;4;3;3;3;3;3;2;ausgewählt;ausgewählt;nicht gewählt;nicht gewählt;nicht gewählt;nicht gewählt;ausgewählt;nicht gewählt;ausgewählt;ausgewählt;nicht gewählt;nicht gewählt;Ja;Ja;Nein;;;;Ja;Ja;Weniger Fehler seitens der Benutzer durch Schulungen.;Verbesserter Umgang mit den jeweiligen Systemen;;;E-Learning;Präsenztraining;;Direkter Kontakt und bessere Hilfestellung bei Problemen;mehr Flexibilität;;Nein;Nein;Eher typisch für mich;Sehr typisch für mich;Eher typisch für mich;Sehr typisch für mich;Sehr typisch für mich;Ziemlich typisch für mich;Ziemlich typisch für mich;Ziemlich typisch für mich;Ziemlich typisch für mich;Eher untypisch für mich;Ziemlich typisch für mich;Eher typisch für mich;Eher typisch für mich;Ziemlich typisch für mich;Eher typisch für mich;Sehr typisch für mich;Ziemlich typisch für mich;Ziemlich typisch für mich;Eher untypisch für mich;Eher untypisch für mich;Eher untypisch für mich;Eher typisch für mich;Eher typisch für mich;Ziemlich typisch für mich;Ziemlich typisch für mich;Eher untypisch für mich;Ziemlich typisch für mich;Eher typisch für mich;Sehr typisch für mich;Eher untypisch für mich;2;ausgewählt;ausgewählt;nicht gewählt;nicht gewählt;1;nicht gewählt;nicht gewählt;ausgewählt;nicht gewählt;1;ausgewählt;nicht gewählt;nicht gewählt;nicht gewählt;2;ausgewählt;nicht gewählt;ausgewählt;nicht gewählt;1;nicht gewählt;ausgewählt;nicht gewählt;nicht gewählt;1;nicht gewählt;ausgewählt;nicht gewählt;nicht gewählt;2;ausgewählt;ausgewählt;nicht gewählt;nicht gewählt;2;ausgewählt;nicht gewählt;ausgewählt;nicht gewählt;1;nicht gewählt;nicht gewählt;ausgewählt;nicht gewählt;2;nicht gewählt;ausgewählt;ausgewählt;nicht gewählt;2;ausgewählt;nicht gewählt;ausgewählt;nicht gewählt;1;nicht gewählt;nicht gewählt;nicht gewählt;ausgewählt;1;nicht gewählt;nicht gewählt;ausgewählt;nicht gewählt;1;nicht gewählt;ausgewählt;nicht gewählt;nicht gewählt;2;nicht gewählt;nicht gewählt;ausgewählt;ausgewählt;1;nicht gewählt;ausgewählt;nicht gewählt;nicht gewählt;VARK;5;5;7;6;PDF;PDF;"Übersichtlicher; kostet weniger Zeit.";-;Zeitstempel einführen (falls möglich);-;1414;646.53;767.36;
